Player,Offense,Defense,GP,Name,Squad,Viable
"Resmi Hardin",0,1,116160,Geonosians Omicron,"zzGBA Sun Fac, Geo Soldier, Geo Spy, Poggle",0
"Resmi Hardin",,,74164,Bad Batch,"Hunter G9, Echo G9, Omega G9, Tech G9, Wrecker G9",0
"Recon Patrol",,,183538,JMK,"zzzzzzJMK zJKA zzGMY zzShaak Ti, zGK",1
"Recon Patrol",1,1,171169,SL Kylo,"zzzzzzSL Kylo, zSith Trooper, zHux zzKRU zzThrawn",1
"Recon Patrol",,,192463,SEE,"zzzzzzSEE zBSF zzMalak zzzDR zzzVader",1
"Recon Patrol",,,569699,Executor,"Executor 6* HT RC Xanadu Blood, Slave I, IG-2000 Gauntlet Starfighter, Tie Adv",1
"Recon Patrol",,,193876,JMLS,"zzzJKR zzJKL zzzzzzJMLS zWat Tambor, zzzzGAS",1
"Recon Patrol",1,0,142848,CLS,"zzzCLS zHan zChewbacca zzC-3PO zChewpio",1
"Recon Patrol",1,1,112991,NS_Alt,"zzMT zzAV Zombie zDaka zzMerrin",1
"Recon Patrol",,,496140,Negotiator,"Negotiator BTL-B Y-wing, Anakin's Eta-2, Rex's ARC-170, Umbaran SF, Ahsoka's SF, Plo's SF, Clone Sergeant's ARC-170",1
"Recon Patrol",,,410376,HansMF,"Home One, Han's MF, Rebel Y-wing, Bistan's U-wing, Phantom Biggs X-wing, Cassian's U-wing, Wedge X-wing",1
"Recon Patrol",0,1,126822,Grievous,"zzGG zB2 zB1 zMagnaGuard zNute",1
"Recon Patrol",1,0,137497,Traya,"zzTraya zzDN zSion zzEP Sith Empire Trooper",1
"Recon Patrol",1,1,112569,JTR,"zzzJTR Scav Rey, BB-8 G8, zzR2-D2 zFinn",1
"Recon Patrol",1,0,115647,Troopers,"zVeers zzPiett Gideon zDark Trooper, Range Trooper",1
"Recon Patrol",,,143275,Disintegration,"zAurra zzGreef zBoba zzBossk zzThe Mandalorian",1
"Recon Patrol",1,1,87907,Carth,"zCarth Onasi, zMission Zaalbar G9, zJuhani Canderous G9",1
"Recon Patrol",1,0,116230,501st,"zRex ARC Trooper G8, zEcho (501st), zzFives zAhsoka",1
"Recon Patrol",0,1,78430,Phoenix,"Hera G8, Ezra zKanan Zeb G8, Chopper G9",1
"Recon Patrol",1,0,123032,zMaul,"zDarth Maul, zDooku zSidious Sith Assassin, zSavage",1
"Recon Patrol",1,0,14622,NestSolo (Counter),"Nest G9",1
"Recon Patrol",,,122530,Phasma,"zPhasma zFOTP FOSFTP zFOST zKylo",0
"Recon Patrol",,,57442,Admiral Raddus,"Admiral Raddus 3* G8, Cassian G7, Jyn G7, K-2SO G8, Chirrut G8",0
"Recon Patrol",,,278634,Malevolence,"Malevolence Hyena Bomber 6*, Vulture Droid 5*, Sun Fac SF 6*, Soldier SF, Spy SF",0
"Recon Patrol",0,1,71808,Geonosians Omicron,"GBA 5* G9, Sun Fac, Geo Soldier, Geo Spy, Poggle G9",0
"Recon Patrol",,,117734,Mon Mothma,"zzMon Mothma, zKyle Katarn, Biggs Lando Wedge",0
"Recon Patrol",1,1,91881,Ewoks,"zChirpa Elder Paploo G7, zWicket zLogray",0
"Recon Patrol",,,88125,Iden Troopers,"zIden Versio, Shoretrooper Snowtrooper G8, Magma G7, zDT",0
"Recon Patrol",0,1,120620,BH,"Jango IG-88 Cad Embo Dengar",0
"Recon Patrol",,,82877,Bad Batch,"zHunter zEcho G9, Omega 6* G6, zTech zWrecker G8",0
"bellojack",,,178523,JMK,"zzzzzzJMK zJKA zzGMY zzShaak Ti, zGK",1
"bellojack",,,168626,LV,"zzzzzzLord Vader, zzThrawn zzzVader RG zzTarkin",1
"bellojack",,,122418,Phasma,"zPhasma zFOTP FOSFTP zFOST zKylo",1
"bellojack",,,153815,SEE,"zzzzzzSEE zBSF zzMalak zzzDR zDooku",1
"bellojack",1,1,171267,GL Rey,"zzzzzzRey zzzJTR zzR2-D2 zHoldo zRH Finn",1
"bellojack",,,159443,Jabba,"zzzzzzJabba zBoushh (Leia Organa), zSkiff Guard (Lando Calrissian), Krrsantan zBoba",1
"bellojack",,,181292,JMLS,"zzzJKR zzJKL zzzzzzJMLS zWat Tambor, zzzzGAS",1
"bellojack",1,0,159865,CLS,"zzzCLS zHan zzChewbacca zzC-3PO zChewpio",1
"bellojack",,,131687,Grievous Omicron,"zzGG zB2 zB1 zMagnaGuard zDroideka",1
"bellojack",,,463679,Negotiator,"Negotiator 6* HT Anakin's Eta-2, Umbaran SF, Ahsoka's SF, BTL-B Y-wing, Clone Sergeant's ARC-170, Plo's SF",1
"bellojack",,,452211,HansMF,"Home One, Han's MF, Rebel Y-wing 6*, Bistan's U-wing, Phantom Ghost Cassian's U-wing, Wedge X-wing",1
"bellojack",,,118122,Mon Mothma,"zzMon Mothma, zCara Dune, zCaptain Rex, Biggs Wedge",1
"bellojack",1,1,103558,Ewoks,"zChirpa Elder zPaploo zWicket zLogray",1
"bellojack",1,1,91293,Carth,"Carth Onasi, zMission zZaalbar zJuhani Canderous",1
"bellojack",0,1,146490,BH,"zzBossk zGreedo zZam zFennec Shand, zzJango",1
"bellojack",1,0,128131,501st,"zRex zARC Trooper, zEcho (501st), zzFives zAhsoka",1
"bellojack",0,1,98803,Phoenix,"zHera zEzra zKanan zZeb zSabine",1
"bellojack",1,1,72930,Rogue1,"Jyn G8, Chirrut G8, Baze G8, K-2SO G9, Cassian G9",1
"bellojack",,,131351,Bad Batch,"zHunter zEcho zzOmega zTech zWrecker",1
"bellojack",1,0,115365,zMaul,"zDarth Maul, zSidious zSavage Sith Empire Trooper, Sith Marauder",1
"bellojack",1,0,122041,EP (Counter, Rebel),"zzEP zKrennic zzWampa Stormtrooper G9, zStarck",1
"bellojack",1,0,21097,SionSolo (Counter),"zSion",1
"bellojack",0,1,85052,Geonosians Omicron,"zzGBA G7, Sun Fac G8, Geo Soldier, Geo Spy, Poggle",0
"bellojack",1,1,76532,NS,"zMT G5, zzAV Daka G8, Zombie G5, Spirit G2",0
"bellojack",1,0,78422,Troopers,"zVeers zzPiett Gideon 6* G2, Dark Trooper 6* G6, Range Trooper 6* G4",0
"bellojack",,,99036,Mando,"zzThe Mandalorian (Beskar Armor), Dash Rendar, Nest G4, zIG-11 zKuiil",0
"bellojack",1,0,69892,Jawas,"Nebit G5, Jawa Engineer G2, Jawa Scavenger G8, Jawa Dathcha",0
"Cathbad333",1,1,157294,SL Kylo,"zzzzzzSL Kylo, zSith Trooper, zHux zzKRU zThrawn G8",1
"Cathbad333",0,1,119569,DRMalak,"zzzDR zzHK-47 zBSF zzMalak Sith Empire Trooper G9",1
"Cathbad333",0,1,135015,padme,"zzPadme zGK zJKA zAhsoka zzC-3PO",1
"Cathbad333",,,133804,Grievous Omicron,"zzGG zB2 zB1 zMagnaGuard zDroideka",1
"Cathbad333",,,438711,Negotiator,"Negotiator HT Anakin's Eta-2, Umbaran SF, Ahsoka's SF, BTL-B Y-wing, Clone Sergeant's ARC-170, Plo's SF",1
"Cathbad333",,,326134,Malevolence,"Malevolence Hyena Bomber, Vulture Droid, Sun Fac SF, Soldier SF, Spy SF",1
"Cathbad333",0,1,105309,Geonosians Omicron,"zzGBA Sun Fac, Geo Soldier, Geo Spy, Poggle",1
"Cathbad333",,,327189,HansMF,"Home One, Han's MF, Biggs X-wing, Bistan's U-wing, Phantom Ghost Cassian's U-wing, Wedge X-wing",1
"Cathbad333",1,1,99423,JTR,"zzzJTR zScav Rey, BB-8 zzR2-D2 G8, zFinn",1
"Cathbad333",,,110192,Nute-Wat,"zNute G8, Dooku zWat Tambor, zJango zNest G9",1
"Cathbad333",1,1,136210,Revan Offense,"zzzJKR zzGMY zBS zJolee zzHYoda",1
"Cathbad333",0,1,113530,BH,"zzBossk zBoba zzThe Mandalorian, Cad zDengar",1
"Cathbad333",1,1,102153,Carth,"Carth Onasi G8, zMission zZaalbar zJuhani zCanderous",1
"Cathbad333",1,0,23127,SionSolo (Counter),"zSion",1
"Cathbad333",,,120589,Phasma,"zPhasma zFOTP FOSFTP zFOST zKylo",0
"Cathbad333",,,113829,SK,"zzEP zzMara Jade, The Emperor's Hand, zzStarkiller Old Ben G9, Visas G7",0
"Cathbad333",1,1,80528,NS,"zzMT G8, zzAV zDaka Zombie G8, Spirit G2",0
"Cathbad333",,,362518,Executrix,"Executrix Tie Adv, Emperor's Shuttle, TIE Reaper 3*, Imperial TIE Fighter, Gauntlet Starfighter, FOSF TIE Fighter, FO TIE Fighter",0
"Cathbad333",1,0,68414,Troopers,"Veers G5, zzPiett 5* zzGideon G8, Dark Trooper, Range Trooper 6* G3",0
"Cathbad333",1,1,95636,GAS,"zzzzGAS G8, zRex G8, zEcho (501st) G9, zzFives zARC Trooper",0
"Cathbad333",1,1,92328,Ewoks,"zChirpa Elder G3, zPaploo zWicket zLogray",0
"Cathbad333",1,0,105055,CLS,"zzzCLS zHan Leia G9, Fulcrum G4, zzChewbacca",0
"Cathbad333",,,56155,Iden Troopers,"zIden Versio G8, Shoretrooper G9, Snowtrooper G4, Magma G4, DT G4",0
"Cathbad333",0,1,85045,Phoenix,"zHera zEzra zKanan G8, Zeb G8, zSabine G6",0
"Cathbad333",1,1,62902,Rogue1,"Jyn G7, Chirrut G7, Baze 6* K-2SO G9, Bodhi Rook G4",0
"Cathbad333",,,69126,Bad Batch,"zHunter G8, zEcho G4, zzOmega G6, zTech G4, zWrecker G8",0
"Cathbad333",1,0,51167,Jawas,"Nebit G4, Jawa Engineer G4, Jawa Scavenger G4, Jawa G6, Dathcha G7",0
"Franklin Empire",,,185633,LV,"zzzzzzLord Vader, zzPiett zzzMaul zRG zzzVader",1
"Franklin Empire",1,1,169522,SL Kylo,"zzzzzzSL Kylo, zSith Trooper, zHux zzKRU zzThrawn",1
"Franklin Empire",,,189797,SEE,"zzzzzzSEE zBSF zzMalak zzzDR zDooku",1
"Franklin Empire",0,1,97896,Qira,"Qira L3-37 zVandor Chewbacca, zMission Zaalbar",1
"Franklin Empire",1,1,155380,GL Rey,"zzzzzzRey zzJTR BB-8 RH Poe, RH Finn",1
"Franklin Empire",,,578475,Executor,"Executor 5* HT RC Xanadu Blood, Slave I, IG-2000 Tie Adv, TIE Reaper",1
"Franklin Empire",0,1,145968,padme,"zzPadme zGK zJKA zAhsoka zzzCAT",1
"Franklin Empire",,,131294,Grievous Omicron,"zzGG zB2 zB1 zMagnaGuard zDroideka",1
"Franklin Empire",,,324849,Malevolence,"Malevolence Hyena Bomber, Vulture Droid, Sun Fac SF, Soldier SF, Spy SF",1
"Franklin Empire",0,1,111315,Geonosians Omicron,"zzGBA Sun Fac, Geo Soldier, Geo Spy, Poggle",1
"Franklin Empire",1,0,140392,Traya,"zzTraya zDN zSion zzEP Sith Empire Trooper",1
"Franklin Empire",1,1,155237,GAS,"zzzzGAS zRex zEcho (501st), zzFives zARC Trooper",1
"Franklin Empire",1,1,122729,Revan Offense,"zzzJKR zGMY BS zJolee zHYoda",1
"Franklin Empire",1,1,108575,Ewoks,"zChirpa Elder Paploo zWicket Logray",1
"Franklin Empire",0,1,140564,BH,"zzBossk zBoba Zam zGreef Dengar",1
"Franklin Empire",1,0,127622,Troopers,"zVeers zStarck zGideon zIden Versio, Stormtrooper",1
"Franklin Empire",0,1,103168,Phoenix,"Hera Ezra Kanan Zeb Sabine",1
"Franklin Empire",1,0,105650,Wiggs,"Wedge Biggs CLS zC-3PO Leia",1
"Franklin Empire",,,131243,Bad Batch,"zHunter zEcho zzOmega zTech zWrecker",1
"Franklin Empire",,,129876,Mando,"zzThe Mandalorian (Beskar Armor), zDash Rendar, zNest IG-11 zKuiil",1
"Franklin Empire",1,0,68970,Jawas,"Nebit G9, Jawa Engineer G9, Jawa Scavenger G9, Jawa G9, Dathcha G9",1
"Franklin Empire",,,115618,Phasma,"Phasma FOTP FOSFTP FOST Kylo",0
"Franklin Empire",1,1,111851,NS,"zMT zAV zDaka Zombie Spirit",0
"Franklin Empire",,,452715,Negotiator,"Negotiator BTL-B Y-wing, Anakin's Eta-2, Rex's ARC-170 4*, Umbaran SF, Ahsoka's SF, Plo's SF, Clone Sergeant's ARC-170",0
"Franklin Empire",,,393491,HansMF,"Home One, Han's MF, Biggs X-wing, Bistan's U-wing 5*, Phantom Ghost Cassian's U-wing, Wedge X-wing",0
"Franklin Empire",0,1,115588,BH,"Jango G8, zThe Mandalorian, IG-88 Cad zEmbo",0
"Franklin Empire",1,1,50224,Rogue1,"Jyn G8, Chirrut 6* G8, Baze G8, K-2SO G8, Cassian G8",0
"Franklin Empire",1,0,130481,zMaul,"Darth Maul, zSidious Sith Assassin, zSavage Sith Marauder",0
"Jameg",,,185453,JMK,"zzzzzzJMK zAhsoka zzzCAT zzzzGAS zGK",1
"Jameg",,,123432,Phasma,"zPhasma zFOTP FOSFTP zFOST zKylo",1
"Jameg",,,140792,Admiral Raddus,"zzAdmiral Raddus, zCassian zJyn Scarif Bistan",1
"Jameg",,,149173,SK,"zzEP zzMara Jade, The Emperor's Hand, zzStarkiller zJuhani zVisas",1
"Jameg",1,1,173688,SL Kylo,"zzzzzzSL Kylo, zSith Trooper, zHux zzKRU zzThrawn",1
"Jameg",,,195707,SEE,"zzzzzzSEE zBSF zzMalak zzzDR zzzVader",1
"Jameg",1,1,170805,GL Rey,"zzzzzzRey zzzJTR zzBB-8 zL3-37 zRH Finn",1
"Jameg",,,594031,Executor,"Executor 5* HT RC Xanadu Blood, Slave I, IG-2000 Gauntlet Starfighter, Tie Adv",1
"Jameg",,,171483,JMLS,"zBS zzzzzzJMLS zWat Tambor, zzJKL zJolee",1
"Jameg",1,0,152441,CLS,"zzzCLS zHan zzChewbacca zzC-3PO zChewpio",1
"Jameg",,,516507,Negotiator,"Negotiator BTL-B Y-wing, Anakin's Eta-2, Rex's ARC-170, Umbaran SF, Ahsoka's SF, Plo's SF, Clone Sergeant's ARC-170",1
"Jameg",,,306780,Malevolence,"Malevolence Hyena Bomber, Vulture Droid, Sun Fac SF, Soldier SF, Spy SF",1
"Jameg",,,524541,HansMF,"Home One, Han's MF, Rebel Y-wing, Bistan's U-wing, Phantom Ghost Cassian's U-wing, Wedge X-wing",1
"Jameg",0,1,125965,Grievous,"zzGG zB2 zB1 zMagnaGuard zNute",1
"Jameg",1,0,136150,Traya,"zzTraya zDN zSion zDooku Sith Empire Trooper",1
"Jameg",,,115353,Mon Mothma,"zzMon Mothma, Cara Dune, zzCaptain Rex, Biggs Wedge",1
"Jameg",1,1,91643,Ewoks,"zChirpa Elder zPaploo zWicket Logray G9",1
"Jameg",1,0,140425,ShaakClones,"zzShaak Ti, zRex zEcho (501st), zzFives zARC Trooper",1
"Jameg",0,1,149552,BH,"zzBossk zBoba zzGreef zzJango Dengar",1
"Jameg",1,0,122913,Troopers,"zVeers zStarck zGideon zzPiett zIden Versio",1
"Jameg",0,1,117120,Phoenix,"zHera zEzra zKanan Zeb zSabine",1
"Jameg",1,0,13534,NestSolo (Counter),"Nest G8",1
"Jameg",0,1,92846,Geonosians Omicron,"zzGBA Sun Fac, Geo Soldier, Geo Spy, Poggle",0
"Jameg",1,1,95253,NS,"MT G9, zAV zDaka Zombie Spirit G2",0
"Jameg",1,1,102747,Carth,"zCarth Onasi, zMission zZaalbar Vandor Chewbacca G5, zCanderous",0
"Jameg",1,0,124034,zMaul,"Darth Maul, zSidious Sith Assassin, zSavage Sith Marauder",0
"Jameg",,,65943,Bad Batch,"Hunter G9, Echo G9, Omega G3, Tech G9, Wrecker G8",0
"Jameg",1,0,52987,Jawas,"Nebit G2, Jawa Engineer G1, Jawa Scavenger G2, Jawa G5, Dathcha G5",0
"Esaascar",,,177208,JMK,"zzzzzzJMK zAhsoka zzzCAT zzzzGAS zGK",1
"Esaascar",,,123061,Phasma,"zPhasma zFOTP FOSFTP zFOST zKylo",1
"Esaascar",1,1,160899,SL Kylo,"zzzzzzSL Kylo, zSith Trooper, zHux zzKRU zzThrawn",1
"Esaascar",0,1,112251,Qira,"Qira zL3-37 zVandor Chewbacca, zMission zZaalbar",1
"Esaascar",,,172264,Jabba,"zzzzzzJabba zBoushh (Leia Organa), zSkiff Guard (Lando Calrissian), zKrrsantan zBoba",1
"Esaascar",1,1,172197,GL Rey,"zzzzzzRey zzzJTR zzBB-8 zRH Poe, zRH Finn",1
"Esaascar",,,143378,SK,"zzEP zzMara Jade, The Emperor's Hand, zzStarkiller zzOld Ben, zVisas",1
"Esaascar",1,1,109947,NS,"zzMT zzAV zDaka Zombie Spirit",1
"Esaascar",,,587963,Executor,"Executor 6* HT RC Xanadu Blood, Slave I, IG-2000 Gauntlet Starfighter, Tie Adv",1
"Esaascar",1,0,154159,CLS,"zzzCLS zHan zzChewbacca zzC-3PO zChewpio",1
"Esaascar",0,1,134986,DRMalak,"zzzDR zzHK-47 zBSF zzMalak Sith Empire Trooper",1
"Esaascar",,,131341,Grievous Omicron,"zzGG zB2 zB1 zMagnaGuard zDroideka",1
"Esaascar",,,505618,Negotiator,"Negotiator BTL-B Y-wing, Anakin's Eta-2, Rex's ARC-170, Umbaran SF, Ahsoka's SF, Plo's SF, Clone Sergeant's ARC-170",1
"Esaascar",,,323741,Malevolence,"Malevolence Hyena Bomber, Vulture Droid, Sun Fac SF, Soldier SF, Spy SF",1
"Esaascar",0,1,105041,Geonosians Omicron,"zzGBA Sun Fac, Geo Soldier, Geo Spy, Poggle",1
"Esaascar",,,494391,HansMF,"Home One, Han's MF, Rebel Y-wing, Bistan's U-wing, Phantom Ghost Cassian's U-wing, Wedge X-wing",1
"Esaascar",1,0,116310,Traya,"zzTraya zzDN zSion zDooku zNest",1
"Esaascar",1,0,136907,Troopers,"zVeers zzPiett zzGideon zDark Trooper, Range Trooper",1
"Esaascar",,,108062,Mon Mothma,"zzMon Mothma, zCara Dune, Pao Biggs Wedge",1
"Esaascar",1,1,145279,Revan Offense,"zzzJKR zzGMY zzHYoda zJolee zEzra",1
"Esaascar",1,1,111995,Ewoks,"zChirpa Elder Paploo zWicket zLogray",1
"Esaascar",1,0,148600,ShaakClones,"zzShaak Ti, zRex zEcho (501st), zzFives zARC Trooper",1
"Esaascar",0,1,150113,BH,"zzBossk zFennec Shand, zEmbo zzJango zDengar",1
"Esaascar",,,90885,Iden Troopers,"zIden Versio, Shoretrooper Snowtrooper Magma DT",1
"Esaascar",0,1,115915,Phoenix,"zHera zKanan zZeb zSabine zzCaptain Rex",1
"Esaascar",1,0,96538,zMaul,"zDarth Maul, zSidious Sith Assassin, zSavage Sith Marauder",1
"Esaascar",1,0,90743,Jawas,"Nebit Jawa Engineer, Jawa Scavenger, Jawa Dathcha",1
"Esaascar",,,81162,Admiral Raddus,"Admiral Raddus 5* G9, Cassian zzJyn K-2SO G9, Bistan",0
"Esaascar",,,159275,JMLS,"zBS zzzzzzJMLS zWat Tambor, zzJKL zBarriss",0
"Esaascar",,,75922,Bad Batch,"zHunter G9, Echo G9, Omega G9, Tech G9, Wrecker G8",0
"Jakoby77",,,180206,JMK,"zzzzzzJMK zAhsoka zzzCAT zzzzGAS zGK",1
"Jakoby77",,,182722,LV,"zzzzzzLord Vader, zzPiett zzzVader zRG zzThrawn",1
"Jakoby77",,,126403,Phasma,"zPhasma zFOTP FOSFTP zFOST zKylo",1
"Jakoby77",,,144496,Admiral Raddus,"zzAdmiral Raddus, zCassian zJyn zK-2SO Bistan",1
"Jakoby77",,,143104,SK,"zzEP zMara Jade, The Emperor's Hand, zzStarkiller zJuhani Visas",1
"Jakoby77",,,461978,Profundity,"Profundity Han's MF, Outrider Rebel Y-wing, Cassian's U-wing, Ghost",1
"Jakoby77",,,187001,SEE,"zzzzzzSEE zBSF zzMalak zzzDR Dooku",1
"Jakoby77",1,1,174341,GL Rey,"zzzzzzRey zzzJTR zzR2-D2 zL3-37 zRH Finn",1
"Jakoby77",,,164350,Jabba,"zzzzzzJabba zBoushh (Leia Organa), zSkiff Guard (Lando Calrissian), zKrrsantan zBoba",1
"Jakoby77",1,1,105434,NS,"zzMT zzAV zDaka Zombie Spirit",1
"Jakoby77",,,607990,Executor,"Executor HT RC Xanadu Blood, Slave I, IG-2000 Imperial TIE Fighter, Tie Adv",1
"Jakoby77",1,0,161002,CLS,"zzzCLS zHan zzChewbacca zzC-3PO zChewpio",1
"Jakoby77",,,166100,JMLS,"zzzzzzJMLS zzJKL zzHYoda zzOld Ben, Ezra",1
"Jakoby77",,,507142,Negotiator,"Negotiator BTL-B Y-wing, Anakin's Eta-2, Rex's ARC-170, Umbaran SF, Ahsoka's SF, Plo's SF, Clone Sergeant's ARC-170",1
"Jakoby77",0,1,138015,Grievous,"zzGG zB2 zB1 MagnaGuard zNute",1
"Jakoby77",1,0,134730,Traya,"zzTraya zDN zSion Sith Empire Trooper, zNest",1
"Jakoby77",,,120946,Mon Mothma,"zzMon Mothma, Hoth Rebel Scout, Baze Scarif zPao",1
"Jakoby77",1,1,143268,Revan Offense,"zzzJKR zGMY BS zJolee zJKA",1
"Jakoby77",1,1,86775,Ewoks,"zChirpa Elder Paploo Wicket Logray G9",1
"Jakoby77",1,0,148379,ShaakClones,"zzShaak Ti, zRex zEcho (501st), zzFives zARC Trooper",1
"Jakoby77",0,1,153431,BH,"zzBossk zZam zFennec Shand, zzJango zDengar",1
"Jakoby77",1,0,124069,Troopers,"zVeers Starck zDark Trooper, zIden Versio, Scout Trooper",1
"Jakoby77",0,1,128191,Phoenix,"zHera zKanan Zeb zSabine zCaptain Rex",1
"Jakoby77",,,132153,Bad Batch,"zHunter zEcho zzOmega zTech zWrecker",1
"Jakoby77",1,0,68137,Jawas,"Nebit G8, Jawa Engineer G8, Jawa Scavenger G8, Jawa Dathcha G8",1
"Jakoby77",,,289541,Malevolence,"Malevolence Hyena Bomber 4*, Vulture Droid 6*, Sun Fac SF, Soldier SF, Spy SF",0
"Jakoby77",0,1,93910,Geonosians Omicron,"zzGBA Sun Fac, Geo Soldier, Geo Spy, Poggle",0
"Jakoby77",1,1,84356,Carth,"zCarth Onasi, zMission zZaalbar Vandor Chewbacca G4, Canderous",0
"Jakoby77",1,0,131097,zMaul,"Darth Maul, zSidious Sith Assassin, zSavage Sith Marauder",0
"Hadriel Jetberg",,,180292,JMK,"zzzzzzJMK zJKA zzGMY zzShaak Ti, zGK",1
"Hadriel Jetberg",,,123367,Phasma,"zPhasma zFOTP FOSFTP zFOST zKylo",1
"Hadriel Jetberg",1,1,171783,SL Kylo,"zzzzzzSL Kylo, zSith Trooper, zHux zzKRU zzThrawn",1
"Hadriel Jetberg",,,192758,SEE,"zzzzzzSEE zBSF zzMalak zzzDR zzzVader",1
"Hadriel Jetberg",1,1,170496,GL Rey,"zzzzzzRey zzzJTR zzBB-8 zRH Poe, zRH Finn",1
"Hadriel Jetberg",,,166249,Jabba,"zzzzzzJabba zBoushh (Leia Organa), zSkiff Guard (Lando Calrissian), zKrrsantan zBoba",1
"Hadriel Jetberg",1,1,111551,NS,"zzMT zzAV zDaka Zombie Spirit",1
"Hadriel Jetberg",,,594696,Executor,"Executor HT RC Xanadu Blood, Slave I, IG-2000 Tie Adv, TIE Reaper",1
"Hadriel Jetberg",1,0,151083,CLS,"zzzCLS zHan zzChewbacca zzC-3PO zChewpio",1
"Hadriel Jetberg",,,130517,Grievous Omicron,"zzGG zB2 zB1 zMagnaGuard zDroideka",1
"Hadriel Jetberg",,,499792,Negotiator,"Negotiator BTL-B Y-wing, Anakin's Eta-2, Rex's ARC-170, Umbaran SF, Ahsoka's SF, Plo's SF, Clone Sergeant's ARC-170",1
"Hadriel Jetberg",,,326622,Malevolence,"Malevolence Hyena Bomber, Vulture Droid, Sun Fac SF, Soldier SF, Spy SF",1
"Hadriel Jetberg",0,1,106150,Geonosians Omicron,"zzGBA Sun Fac, Geo Soldier, Geo Spy, Poggle",1
"Hadriel Jetberg",,,142629,JKL,"zzJKL zzzJKR zzHYoda zzOld Ben, Aayla",1
"Hadriel Jetberg",,,458341,HansMF,"Home One, Han's MF, Rebel Y-wing, Bistan's U-wing, Phantom Ghost Cassian's U-wing, Wedge X-wing",1
"Hadriel Jetberg",1,0,130254,Traya,"zzTraya zDN zSion zzEP Sith Empire Trooper",1
"Hadriel Jetberg",1,0,128470,Troopers,"zVeers zzPiett zzGideon zDark Trooper, Range Trooper",1
"Hadriel Jetberg",,,133249,Nute-Wat,"zNute zDooku zWat Tambor, zzJango zNest",1
"Hadriel Jetberg",1,1,138459,GAS,"zzzzGAS zRex zEcho (501st), zzFives zARC Trooper",1
"Hadriel Jetberg",1,1,113542,Ewoks,"zChirpa Elder Paploo zWicket zLogray",1
"Hadriel Jetberg",1,1,96872,Carth,"zCarth Onasi, zMission zZaalbar zJuhani Canderous",1
"Hadriel Jetberg",0,1,147427,BH,"zzBossk zGreedo zzAurra zFennec Shand, zDengar",1
"Hadriel Jetberg",,,95038,Iden Troopers,"zIden Versio, zStormtrooper Snowtrooper Magma zDT",1
"Hadriel Jetberg",0,1,99488,Phoenix,"zHera zEzra zKanan zZeb zSabine",1
"Hadriel Jetberg",1,1,79842,Rogue1,"Jyn Chirrut G8, Baze G8, K-2SO Cassian",1
"Hadriel Jetberg",1,0,87104,Jawas,"Nebit Jawa Engineer, Jawa Scavenger, Jawa Dathcha",1
"Hadriel Jetberg",,,87994,Mon Mothma,"zzMon Mothma G9, Cara Dune, Hoth Rebel Scout, Scarif Wedge",0
"Hadriel Jetberg",1,0,127361,zMaul,"Darth Maul, zSidious Sith Assassin, zSavage Sith Marauder",0
"Hadriel Jetberg",,,97129,Bad Batch,"zHunter zEcho Omega G8, zTech zWrecker",0
"BrianSkywalker",,,180936,JMK,"zzzzzzJMK zJKA zzGMY zzShaak Ti, zGK",1
"BrianSkywalker",,,127298,Phasma,"zPhasma zFOTP FOSFTP zFOST zKylo",1
"BrianSkywalker",,,152769,Admiral Raddus,"zzAdmiral Raddus, zCassian zzJyn zK-2SO Bistan",1
"BrianSkywalker",1,1,159585,SL Kylo,"zzzzzzSL Kylo, zSith Trooper, zHux zzKRU zzThrawn",1
"BrianSkywalker",1,1,176601,GL Rey,"zzzzzzRey zzzJTR zzR2-D2 zHoldo zRH Finn",1
"BrianSkywalker",0,1,100885,Qira,"zQira zL3-37 zVandor Chewbacca, zMission zZaalbar",1
"BrianSkywalker",1,1,127393,NS,"zzMT zzAV zDaka Zombie Spirit",1
"BrianSkywalker",,,194019,JMLS,"zzzJKR zzJKL zzzzzzJMLS zWat Tambor, zzzzGAS",1
"BrianSkywalker",1,0,162093,CLS,"zzzCLS zHan zzChewbacca zzC-3PO zChewpio",1
"BrianSkywalker",0,1,142781,DRMalak,"zzzDR zzHK-47 zBSF zzMalak Sith Empire Trooper",1
"BrianSkywalker",,,136108,Grievous Omicron,"zzGG zB2 zB1 zMagnaGuard zDroideka",1
"BrianSkywalker",,,538416,Negotiator,"Negotiator HT Anakin's Eta-2, Umbaran SF, Ahsoka's SF, BTL-B Y-wing, Clone Sergeant's ARC-170, Plo's SF",1
"BrianSkywalker",,,347548,Malevolence,"Malevolence Hyena Bomber, Vulture Droid, Sun Fac SF, Soldier SF, Spy SF",1
"BrianSkywalker",0,1,126208,Geonosians Omicron,"zzGBA Sun Fac, Geo Soldier, Geo Spy, Poggle",1
"BrianSkywalker",,,529755,HansMF,"Home One, Han's MF, Rebel Y-wing, Bistan's U-wing, Phantom Ghost Cassian's U-wing, Wedge X-wing",1
"BrianSkywalker",,,100371,Mon Mothma,"zzMon Mothma, zCara Dune, Hoth Rebel Scout, Scarif Pao",1
"BrianSkywalker",1,0,129025,Traya,"zzTraya zDN zSion zDooku zzEP",1
"BrianSkywalker",1,0,115737,Troopers,"zVeers zzPiett zzGideon zDark Trooper, Range Trooper",1
"BrianSkywalker",,,530065,Executrix,"Executrix Tie Adv, Emperor's Shuttle, TIE Reaper, Imperial TIE Fighter, Gauntlet Starfighter, FOSF TIE Fighter, FO TIE Fighter",1
"BrianSkywalker",,,132404,Disintegration,"zAurra zzGreef zBoba zzBossk zThe Mandalorian",1
"BrianSkywalker",1,1,121197,Ewoks,"zChirpa Elder zPaploo zWicket zLogray",1
"BrianSkywalker",0,1,140041,BH,"zzJango zIG-88 Krrsantan Cad zDengar",1
"BrianSkywalker",1,0,152140,501st,"zRex zARC Trooper, zEcho (501st), zzFives zAhsoka",1
"BrianSkywalker",,,93907,Iden Troopers,"zIden Versio, zStormtrooper Snowtrooper Magma zDT",1
"BrianSkywalker",0,1,107880,Phoenix,"zHera zEzra zKanan zSabine zCaptain Rex",1
"BrianSkywalker",1,0,108997,Wiggs,"Wedge Biggs zLeia Chirrut Baze",1
"BrianSkywalker",,,111088,Mando,"zzThe Mandalorian (Beskar Armor), zDash Rendar, zNest zIG-11 Kuiil",1
"BrianSkywalker",1,0,95229,zMaul,"zDarth Maul, zSidious Sith Assassin, zSavage Sith Marauder",1
"BrianSkywalker",,,104769,Bad Batch,"zHunter zEcho zzOmega zTech zWrecker",1
"BrianSkywalker",1,0,88105,Jawas,"Nebit Jawa Engineer, Jawa Scavenger, Jawa Dathcha",1
"Jollyrogercjf",,,166917,JMK,"zzzzzzJMK zAhsoka zzzCAT zJKA zGK",1
"Jollyrogercjf",,,114920,Phasma,"zPhasma FOTP FOSFTP FOST Kylo",1
"Jollyrogercjf",1,1,160804,SL Kylo,"zzzzzzSL Kylo, Sith Trooper, zHux zzKRU zzThrawn",1
"Jollyrogercjf",,,159134,SEE,"zzzzzzSEE zBSF zzMalak zzzDR zzzVader",1
"Jollyrogercjf",1,1,166207,GL Rey,"zzzzzzRey zzzJTR zzBB-8 zL3-37 RH Finn",1
"Jollyrogercjf",,,162426,Jabba,"zzzzzzJabba zBoushh (Leia Organa), zSkiff Guard (Lando Calrissian), Krrsantan Boba",1
"Jollyrogercjf",,,132445,SK,"zzEP zzMara Jade, The Emperor's Hand, zzStarkiller Old Ben, zVisas",1
"Jollyrogercjf",1,1,99098,NS,"zzMT zzAV zDaka Zombie Spirit",1
"Jollyrogercjf",1,0,152761,CLS,"zzzCLS zHan zzChewbacca zzC-3PO zChewpio",1
"Jollyrogercjf",,,129026,Grievous Omicron,"zzGG zB2 zB1 MagnaGuard zDroideka",1
"Jollyrogercjf",,,509952,Negotiator,"Negotiator HT Anakin's Eta-2, Umbaran SF, Ahsoka's SF, BTL-B Y-wing, Clone Sergeant's ARC-170, Plo's SF",1
"Jollyrogercjf",,,308144,Malevolence,"Malevolence Hyena Bomber, Vulture Droid, Sun Fac SF, Soldier SF, Spy SF",1
"Jollyrogercjf",,,418658,HansMF,"Home One, Han's MF, Rebel Y-wing, Bistan's U-wing, Phantom Biggs X-wing, Cassian's U-wing, Wedge X-wing",1
"Jollyrogercjf",1,0,106833,Traya,"zzTraya zDN zSion zDooku Sith Empire Trooper G8",1
"Jollyrogercjf",1,0,114352,Troopers,"zVeers zzPiett zGideon zDark Trooper, Range Trooper",1
"Jollyrogercjf",,,118699,Mon Mothma,"zzMon Mothma, zCara Dune, Biggs Lando Wedge",1
"Jollyrogercjf",1,1,140716,GAS,"zzzzGAS zRex zEcho (501st), zzFives zARC Trooper",1
"Jollyrogercjf",1,1,129948,Revan Offense,"zzzJKR zGMY zBS zJolee zzHYoda",1
"Jollyrogercjf",1,1,85071,Ewoks,"zChirpa Elder Paploo Wicket Logray",1
"Jollyrogercjf",1,1,91712,Carth,"Carth Onasi, zMission zZaalbar Juhani G9, Canderous",1
"Jollyrogercjf",0,1,133580,BH,"zzBossk Greedo Fennec Shand, zJango Dengar",1
"Jollyrogercjf",0,1,70746,Phoenix,"Hera Ezra G8, Kanan G8, Zeb G8, Sabine",1
"Jollyrogercjf",1,1,57872,Rogue1,"Jyn G8, Chirrut G8, Baze G8, K-2SO G8, Cassian G8",1
"Jollyrogercjf",,,127079,Mando,"zzThe Mandalorian (Beskar Armor), zDash Rendar, zNest zIG-11 zKuiil",1
"Jollyrogercjf",1,0,88748,Jawas,"Nebit Jawa Engineer, Jawa Scavenger, Jawa Dathcha",1
"Jollyrogercjf",0,1,93915,Geonosians Omicron,"zzGBA Sun Fac, Geo Soldier, Geo Spy, Poggle",0
"Jollyrogercjf",,,451379,Executrix,"Executrix Tie Adv, Emperor's Shuttle, TIE Reaper 4*, Imperial TIE Fighter, Gauntlet Starfighter, FOSF TIE Fighter, FO TIE Fighter",0
"Jollyrogercjf",,,69916,Iden Troopers,"zIden Versio, Shoretrooper Snowtrooper G8, Magma G7, DT G8",0
"Jollyrogercjf",,,72839,Bad Batch,"Hunter G9, Echo G9, zOmega G9, Tech G9, Wrecker G9",0
"LordViolence",,,173042,JMK,"zzzzzzJMK zJKA zGMY zShaak Ti, zGK",1
"LordViolence",,,172775,LV,"zzzzzzLord Vader, zzPiett zzzVader zRG zTarkin",1
"LordViolence",,,121096,Phasma,"zPhasma FOTP FOSFTP zFOST zKylo",1
"LordViolence",1,1,165493,SL Kylo,"zzzzzzSL Kylo, zSith Trooper, zHux zzKRU zzThrawn",1
"LordViolence",,,167840,SEE,"zzzzzzSEE zBSF zzMalak zzzDR zDooku",1
"LordViolence",1,1,171095,GL Rey,"zzzzzzRey zzzJTR zzR2-D2 zRH Poe, zRH Finn",1
"LordViolence",1,1,102284,NS,"zzMT zAV zDaka Zombie Spirit",1
"LordViolence",,,581203,Executor,"Executor HT RC Xanadu Blood, Slave I, IG-2000 Imperial TIE Fighter, Tie Adv",1
"LordViolence",,,181659,JMLS,"zzzJKR zzJKL zzzzzzJMLS zWat Tambor, zzzzGAS",1
"LordViolence",1,0,154419,CLS,"zzzCLS zHan zzChewbacca zzC-3PO zChewpio",1
