Player,Offense,Defense,GP,Name,Squad,Viable
"Yog Dingham",,,77493,Bad Batch,"zHunter Echo G9, Omega G9, Tech G9, Wrecker G8",0
"Guitarman007",,,193470,JMK,"zzzzzzJMK zAhsoka zzzCAT zzzzGAS zGK",1
"Guitarman007",,,176561,LV,"zzzzzzLord Vader, zzPiett zzzVader zRG zNinth Sister",1
"Guitarman007",,,181086,SEE,"zzzzzzSEE zBSF zzMalak zzzDR zDooku",1
"Guitarman007",1,1,179510,GL Rey,"zzzzzzRey zzzJTR zzR2-D2 zRH Poe, zRH Finn",1
"Guitarman007",1,0,156174,CLS,"zzzCLS zHan zzChewbacca zzC-3PO zChewpio",1
"Guitarman007",1,1,109283,NestSisters,"zzAV zzMT zDaka Zombie zNest",1
"Guitarman007",,,163470,JMLS,"zzzzzzJMLS zzJKL zzHYoda zzOld Ben, zEzra",1
"Guitarman007",,,514083,Negotiator,"Negotiator HT Anakin's Eta-2, Umbaran SF, Ahsoka's SF, BTL-B Y-wing, Clone Sergeant's ARC-170, Plo's SF",1
"Guitarman007",,,445997,HansMF,"Home One, Han's MF, Rebel Y-wing 6*, Bistan's U-wing, Phantom Ghost Cassian's U-wing, Wedge X-wing",1
"Guitarman007",0,1,133987,Grievous,"zzGG zB2 zB1 zMagnaGuard zNute",1
"Guitarman007",1,0,122795,Traya,"zzTraya zzDN zSion Sith Empire Trooper, zzThrawn",1
"Guitarman007",,,120080,Mon Mothma,"zzMon Mothma, Wedge zCara Dune, Baze Biggs",1
"Guitarman007",,,109414,Disintegration,"Aurra Greef zBoba zzBossk zzThe Mandalorian",1
"Guitarman007",1,1,136107,Revan Offense,"zzzJKR zzGMY zBS zJolee zJKA",1
"Guitarman007",1,0,140949,ShaakClones,"zzShaak Ti, zRex zEcho (501st), zzFives zARC Trooper",1
"Guitarman007",1,1,102761,Ewoks,"zChirpa Elder zPaploo Teebo zWicket",1
"Guitarman007",1,1,97923,Carth,"Carth Onasi, zMission zZaalbar zJuhani zCanderous",1
"Guitarman007",0,1,140773,BH,"zzJango zzEmbo zDengar zZam zBoushh (Leia Organa)",1
"Guitarman007",1,0,122384,Troopers,"zVeers zStarck zIden Versio, zDT zzScout Trooper",1
"Guitarman007",0,1,108883,Phoenix,"zHera zKanan zZeb Sabine G8, zzCaptain Rex",1
"Guitarman007",0,1,103035,FO,"zzKRU zKylo zPhasma FOO zFOTP",1
"Guitarman007",,,124947,Bad Batch,"zHunter zEcho zzOmega zTech zWrecker",1
"Guitarman007",1,0,112133,zMaul,"zDarth Maul, zSidious Sith Assassin, Savage Sith Marauder",1
"Guitarman007",,,73724,Admiral Raddus,"Admiral Raddus 3* G7, Cassian G8, Jyn K-2SO Chirrut",0
"Guitarman007",0,1,105640,Geonosians Omicron,"zzGBA Sun Fac, Geo Soldier, Geo Spy, Poggle",0
"Guitarman007",1,0,117120,EP (Counter, Rebel),"zzEP Shoretrooper G7, zKrennic zzWampa zStormtrooper",0
"Guitarman007",1,0,64314,Jawas,"Nebit G7, Jawa Engineer G7, Jawa Scavenger G8, Jawa G7, Dathcha G7",0
"Tugboat Al",,,176562,JMLS,"zzzJKR zzJKL zzzzzzJMLS zWat Tambor, zzzzGAS",1
"Tugboat Al",1,0,145626,CLS,"zzzCLS zHan zzChewbacca zzC-3PO zChewpio",1
"Tugboat Al",0,1,136844,DRMalak,"zzzDR zzHK-47 zBSF zzMalak Sith Empire Trooper",1
"Tugboat Al",0,1,125821,padme,"zzPadme zGK zJKA zAhsoka zBarriss",1
"Tugboat Al",,,125143,Grievous Omicron,"zzGG zB2 zB1 zMagnaGuard zDroideka",1
"Tugboat Al",1,1,119940,NS_Alt,"zzMT zzAV zzMerrin Zombie zDaka",1
"Tugboat Al",0,1,99614,Geonosians Omicron,"zzGBA Sun Fac, Geo Soldier, Geo Spy, Poggle",1
"Tugboat Al",,,405017,HansMF,"Home One, Han's MF, Rebel Y-wing 6*, Bistan's U-wing, Phantom Ghost Cassian's U-wing, Wedge X-wing",1
"Tugboat Al",,,507382,Negotiator,"Negotiator HT Anakin's Eta-2, Umbaran SF, Ahsoka's SF, Clone Sergeant's ARC-170, Plo's SF, Rex's ARC-170",1
"Tugboat Al",1,0,132404,Traya,"zzTraya zzDN zSion zzEP Thrawn G8",1
"Tugboat Al",,,124894,Nute-OR,"zNute zDooku zzJango zZaalbar zMission",1
"Tugboat Al",,,110846,Mon Mothma,"zzMon Mothma, Wedge zCara Dune, Biggs Lando",1
"Tugboat Al",1,1,96080,Ewoks,"zChirpa Elder zPaploo zWicket zLogray",1
"Tugboat Al",1,0,137942,ShaakClones,"zzShaak Ti, zRex zEcho (501st), zzFives zARC Trooper",1
"Tugboat Al",0,1,129932,BH,"zzBossk zzThe Mandalorian, zBoba zDengar zZam",1
"Tugboat Al",0,1,100095,Phoenix,"zHera zEzra zKanan zZeb zSabine",1
"Tugboat Al",0,1,141573,BS,"zBS zzGMY zJolee zzOld Ben, zzHYoda",1
"Tugboat Al",,,66011,Phasma,"Phasma G8, FOTP FOSFTP G7, FOST 2* G4, zKylo",0
"Tugboat Al",1,1,114448,JTR,"zzzJTR Scav Rey, BB-8 G7, zzR2-D2 Finn",0
"Tugboat Al",1,0,45672,Troopers,"Veers G9, Piett 4* G5, Gideon 6* G5, Dark Trooper 5* G4, Range Trooper 5* G6",0
"Tugboat Al",,,50786,Iden Troopers,"Iden Versio 5* G6, Stormtrooper G5, Snowtrooper G7, Magma G4, DT 6* G3",0
"Tugboat Al",,,71157,Mando,"zzThe Mandalorian (Beskar Armor), Dash Rendar 5* G4, Nest 4* G6, IG-11 Kuiil",0
"Tugboat Al",1,1,59006,Rogue1,"Jyn G5, Chirrut G8, Baze 5* G6, K-2SO G7, Pao G8",0
"Tugboat Al",1,0,60203,Jawas,"Nebit G7, Jawa Engineer G7, Jawa Scavenger G8, Jawa G7, Dathcha G7",0
"FireEmtTV",,,127040,Phasma,"zPhasma zFOTP FOSFTP zFOST zKylo",1
"FireEmtTV",1,1,148170,SL Kylo,"zzzzSL Kylo, zSith Trooper, zHux zzKRU zzThrawn",1
"FireEmtTV",,,440509,Negotiator,"Negotiator HT Anakin's Eta-2, Umbaran SF, Ahsoka's SF, Clone Sergeant's ARC-170, Jedi Consular's Starfighter, Plo's SF",1
"FireEmtTV",1,1,111323,JTR,"zzzJTR zzR2-D2 BB-8 RH Finn, RH Poe",1
"FireEmtTV",0,1,107638,Grievous,"zzGG B2 Droideka MagnaGuard T3-M4",1
"FireEmtTV",,,124873,Disintegration,"Aurra Greef zBoba zzBossk zThe Mandalorian",1
"FireEmtTV",1,1,122045,Revan,"zzzJKR zBS zzGMY zJolee zGK",1
"FireEmtTV",1,1,83610,Ewoks,"zChirpa Elder zPaploo Wicket Logray",1
"FireEmtTV",1,1,101621,Carth,"Carth Onasi, zMission zZaalbar Juhani Canderous",1
"FireEmtTV",1,1,119390,zEP,"zzEP zzzVader zTarkin TFP G8, zBSF",1
"FireEmtTV",0,1,90542,BH,"zzJango IG-88 G8, Embo G9, Cad Greedo",1
"FireEmtTV",0,1,102880,Phoenix,"zHera Ezra Kanan Zeb Sabine",1
"FireEmtTV",1,0,111055,Wiggs,"Wedge Biggs zzzCLS C-3PO Leia",1
"FireEmtTV",,,342609,HansMF,"Home One, Han's MF 5*, Biggs X-wing, Bistan's U-wing 5*, Phantom Ghost Cassian's U-wing, Wedge X-wing",0
"FireEmtTV",,,86246,Mon Mothma,"Mon Mothma 4* G8, Cara Dune, zKyle Katarn, Chirrut G8, Lando",0
"FireEmtTV",1,1,57013,NS_Alt,"MT 5* G8, AV Talia Spirit 5* G8, Daka",0
"FireEmtTV",1,0,93063,ShaakClones,"Shaak Ti, Rex Echo (501st) G9, Fives Clone Sergeant",0
"FireEmtTV",1,0,53264,Troopers,"Veers G9, Starck G9, Snowtrooper G8, Gideon G8, Stormtrooper G9",0
"FireEmtTV",1,0,88910,zMaul,"Darth Maul G8, Dooku DN zzzDR zSavage",0
"FireEmtTV",1,0,95247,QGJ,"zQGJ Aayla G6, JKA zOld Ben, Ahsoka",0
"Markus Steel",,,176634,JMK,"zzzzzzJMK zAhsoka zzzCAT zzzzGAS zGK",1
"Markus Steel",1,1,154286,SL Kylo,"zzzzzzSL Kylo, zSith Trooper, zHux zzKRU zThrawn",1
"Markus Steel",,,155368,Jabba,"zzzzzzJabba Boushh (Leia Organa), Skiff Guard (Lando Calrissian), Krrsantan zBoba",1
"Markus Steel",1,1,105329,NS,"zzMT zzAV zDaka Zombie Spirit",1
"Markus Steel",,,568093,Executor,"Executor 6* HT RC Xanadu Blood, Slave I, IG-2000 Tie Adv, TIE Reaper",1
"Markus Steel",1,0,154123,CLS,"zzzCLS zHan zzChewbacca zzC-3PO zChewpio",1
"Markus Steel",0,1,126991,DRMalak,"zzzDR zzHK-47 zBSF zzMalak Sith Empire Trooper",1
"Markus Steel",,,498306,Negotiator,"Negotiator BTL-B Y-wing, Anakin's Eta-2, Rex's ARC-170, Umbaran SF, Ahsoka's SF, Plo's SF, Clone Sergeant's ARC-170",1
"Markus Steel",,,306713,Malevolence,"Malevolence Hyena Bomber, Vulture Droid, Sun Fac SF, Soldier SF, Spy SF",1
"Markus Steel",0,1,97086,Geonosians Omicron,"zzGBA Sun Fac, Geo Soldier, Geo Spy, Poggle",1
"Markus Steel",,,141183,JKL,"zzJKL zzzJKR zzHYoda zzOld Ben, Aayla",1
"Markus Steel",,,443837,HansMF,"Home One, Han's MF, Rebel Y-wing, Ghost Phantom Biggs X-wing, Cassian's U-wing, Wedge X-wing",1
"Markus Steel",1,1,132300,JTR,"zzzJTR zzR2-D2 zzBB-8 RH Finn, RH Poe",1
"Markus Steel",0,1,122256,Grievous,"zzGG zB2 zB1 zMagnaGuard zNute",1
"Markus Steel",,,106042,Mon Mothma,"zzMon Mothma, Hoth Rebel Scout, Wedge zCara Dune, zPao",1
"Markus Steel",1,0,116970,Traya,"zzTraya zDN zSion zDooku zzEP",1
"Markus Steel",1,0,141618,ShaakClones,"zzShaak Ti, zRex zEcho (501st), zzFives zARC Trooper",1
"Markus Steel",1,1,96209,Carth,"zCarth Onasi, zMission zZaalbar zJuhani Canderous",1
"Markus Steel",0,1,137685,BH,"zzBossk zJango zDengar Greedo Fennec Shand",1
"Markus Steel",1,0,134487,Troopers,"zVeers zStarck Range Trooper, zzPiett zGideon",1
"Markus Steel",0,1,81078,Phoenix,"Hera G8, zEzra Kanan G8, Zeb G8, zSabine",1
"Markus Steel",1,1,88124,Rogue1,"zJyn Chirrut Baze K-2SO G8, zCassian",1
"Markus Steel",1,0,89970,Jawas,"Nebit Jawa Engineer, Jawa Scavenger, Jawa Dathcha",1
"Markus Steel",1,0,18741,NestSolo (Counter),"zNest",1
"Markus Steel",,,116202,Phasma,"Phasma FOTP FOSFTP zFOST zKylo",0
"Markus Steel",,,77642,Iden Troopers,"Iden Versio G8, Shoretrooper Snowtrooper Magma G7, DT",0
"Markus Steel",,,68742,Bad Batch,"Hunter G7, Echo G9, Omega G9, Tech G9, Wrecker G8",0
"BaptizedInFilth",,,175023,JMK,"zzzzzzJMK zAhsoka zzzCAT zzPadme zGK",1
"BaptizedInFilth",,,125581,Phasma,"zPhasma zFOTP FOSFTP zFOST zKylo",1
"BaptizedInFilth",1,1,167692,GL Rey,"zzzzzzRey zzzJTR zBB-8 zRH Poe, zRH Finn",1
"BaptizedInFilth",,,140122,SK,"zzEP zzMara Jade, The Emperor's Hand, zzStarkiller zOld Ben, zVisas",1
"BaptizedInFilth",0,1,134614,DRMalak,"zzzDR zzHK-47 zBSF zzMalak Sith Empire Trooper",1
"BaptizedInFilth",1,0,135668,CLS,"zzzCLS zHan zzChewbacca zzC-3PO zChewpio",1
"BaptizedInFilth",,,476214,HansMF,"Home One, Han's MF, HT Ghost Phantom Biggs X-wing, Cassian's U-wing, Wedge X-wing",1
"BaptizedInFilth",0,1,134154,Grievous,"zzGG zB2 zB1 zMagnaGuard zNute",1
"BaptizedInFilth",,,120016,Disintegration,"Aurra zGreef zBoba zBossk zThe Mandalorian",1
"BaptizedInFilth",1,1,129241,Revan Offense,"zzzJKR zzGMY BS Jolee zJKA",1
"BaptizedInFilth",1,1,91992,Ewoks,"zChirpa Elder zPaploo Wicket Logray",1
"BaptizedInFilth",1,1,103395,Carth,"zCarth Onasi, zMission Zaalbar zJuhani zCanderous",1
"BaptizedInFilth",0,1,142303,BH,"zzJango zEmbo Cad zKrrsantan zZam",1
"BaptizedInFilth",0,1,109745,Phoenix,"Hera zEzra Kanan zZeb Sabine",1
"BaptizedInFilth",1,1,66266,Rogue1,"Jyn G8, Chirrut G8, Baze G8, K-2SO G8, Cassian G9",1
"BaptizedInFilth",1,0,14538,SionSolo (Counter),"Sion G9",1
"BaptizedInFilth",1,0,12384,NestSolo (Counter),"Nest G8",1
"BaptizedInFilth",1,1,160196,SL Kylo,"zzzzzzSL Kylo, zSith Trooper, zHux zzKRU Thrawn G7",0
"BaptizedInFilth",1,1,106714,NS,"MT zAV Daka Zombie Spirit",0
"BaptizedInFilth",,,364035,Negotiator,"Negotiator BTL-B Y-wing 2*, Anakin's Eta-2, Rex's ARC-170 4*, Umbaran SF, Ahsoka's SF, Plo's SF 4*, Clone Sergeant's ARC-170",0
"BaptizedInFilth",0,1,109288,Geonosians Omicron,"zGBA Sun Fac, Geo Soldier, Geo Spy, Poggle",0
"BaptizedInFilth",1,0,120123,ShaakClones,"zzShaak Ti, Rex G8, zEcho (501st), Fives G8, zARC Trooper",0
"BaptizedInFilth",1,0,59959,Troopers,"Veers G8, Starck G6, DT G8, Gideon 6* G8, Stormtrooper G8",0
"BaptizedInFilth",,,109064,Bad Batch,"zHunter zEcho 6* Omega G8, zTech zWrecker",0
"Dragon Reborn",,,422298,Profundity,"Profundity 5* Han's MF, Outrider Rebel Y-wing, Cassian's U-wing, Ghost",1
"Dragon Reborn",1,1,157707,SL Kylo,"zzzzzzSL Kylo, Sith Trooper, zHux zzKRU zThrawn",1
"Dragon Reborn",1,1,142749,GL Rey,"zzzzzRey JTR BB-8 RH Poe, zRH Finn",1
"Dragon Reborn",0,1,141665,padme,"zzPadme zGK zJKA zAhsoka zzzCAT",1
"Dragon Reborn",1,0,137478,CLS,"zzzCLS zHan zzChewbacca C-3PO Chewpio",1
"Dragon Reborn",,,471233,Negotiator,"Negotiator HT Anakin's Eta-2, Umbaran SF, Ahsoka's SF, BTL-B Y-wing, Clone Sergeant's ARC-170, Plo's SF",1
"Dragon Reborn",0,1,120056,Grievous,"zzGG zB2 zB1 zMagnaGuard T3-M4",1
"Dragon Reborn",1,0,128196,Traya,"zzTraya zDN zSion zBSF zzEP",1
"Dragon Reborn",,,111880,Disintegration,"Aurra zGreef Boba zzBossk zThe Mandalorian",1
"Dragon Reborn",,,119039,Mon Mothma,"Mon Mothma, Wedge zCassian Bistan Biggs",1
"Dragon Reborn",1,1,134725,GAS,"zzzzGAS zRex zEcho (501st), zzFives zARC Trooper",1
"Dragon Reborn",1,1,105230,Revan Offense,"zzzJKR GMY BS zJolee HYoda G9",1
"Dragon Reborn",1,1,81614,Ewoks,"zChirpa Elder Paploo Wicket Logray",1
"Dragon Reborn",1,1,83889,Carth,"Carth Onasi, Mission Zaalbar Juhani G8, Canderous",1
"Dragon Reborn",0,1,107916,Phoenix,"Hera Ezra Kanan Zeb Sabine",1
"Dragon Reborn",1,0,13129,NestSolo (Counter),"Nest G8",1
"Dragon Reborn",,,111055,Phasma,"Phasma FOTP FOSFTP FOST Kylo",0
"Dragon Reborn",,,263602,Malevolence,"Malevolence Hyena Bomber 4*, Vulture Droid, Sun Fac SF, Soldier SF, Spy SF",0
"Dragon Reborn",0,1,86605,Geonosians Omicron,"zGBA Sun Fac, Geo Soldier, Geo Spy, Poggle",0
"Dragon Reborn",1,1,84604,NS,"MT AV zDaka Zombie Spirit 5* G8",0
"Dragon Reborn",,,361691,Executrix,"Executrix Tie Adv, Emperor's Shuttle 4*, TIE Reaper 5*, Imperial TIE Fighter, Gauntlet Starfighter 6*, FOSF TIE Fighter, FO TIE Fighter",0
"Dragon Reborn",1,0,82406,Troopers,"Veers zPiett Gideon G9, Dark Trooper G9, Range Trooper",0
"Dragon Reborn",0,1,86107,BH,"Jango IG-88 Cad G9, Dengar G8, zZam",0
"Dragon Reborn",1,1,98178,Rogue1,"Jyn Chirrut G8, Baze 6* G8, zK-2SO zzAdmiral Raddus",0
"JohnFarson",,,177481,JMK,"zzzzzzJMK zAhsoka zzzCAT zzzzGAS zGK",1
"JohnFarson",,,172309,LV,"zzzzzzLord Vader, zzPiett zzzVader zRG Tarkin",1
"JohnFarson",,,124912,Phasma,"zPhasma zFOTP FOSFTP zFOST zKylo",1
"JohnFarson",1,1,164249,SL Kylo,"zzzzzzSL Kylo, zSith Trooper, zHux zzKRU zzThrawn",1
"JohnFarson",,,173204,SEE,"zzzzzzSEE zBSF zzMalak zzzDR zDooku",1
"JohnFarson",1,1,168695,GL Rey,"zzzzzzRey zzzJTR zzR2-D2 zRH Poe, zRH Finn",1
"JohnFarson",,,163844,Jabba,"zzzzzzJabba zBoushh (Leia Organa), zSkiff Guard (Lando Calrissian), zKrrsantan zBoba",1
"JohnFarson",,,140327,SK,"zzEP zzMara Jade, The Emperor's Hand, zzStarkiller zzOld Ben, zVisas",1
"JohnFarson",,,568062,Executor,"Executor 5* HT RC Xanadu Blood, Slave I, IG-2000 Imperial TIE Fighter, Tie Adv",1
"JohnFarson",1,0,153933,CLS,"zzzCLS zHan zzChewbacca zzC-3PO zChewpio",1
"JohnFarson",1,1,124488,NestSisters,"zzAV zzMT zDaka Zombie zNest",1
"JohnFarson",,,129186,Grievous Omicron,"zzGG zB2 zB1 zMagnaGuard zDroideka",1
"JohnFarson",,,506014,Negotiator,"Negotiator BTL-B Y-wing, Anakin's Eta-2, Rex's ARC-170, Umbaran SF, Ahsoka's SF, Plo's SF, Clone Sergeant's ARC-170",1
"JohnFarson",,,306823,Malevolence,"Malevolence Hyena Bomber, Vulture Droid, Sun Fac SF, Soldier SF, Spy SF",1
"JohnFarson",,,469809,HansMF,"Home One, Han's MF, Rebel Y-wing, Bistan's U-wing, Phantom Biggs X-wing, Cassian's U-wing, Wedge X-wing",1
"JohnFarson",,,104144,Mon Mothma,"zzMon Mothma, Wedge Cara Dune, Bistan Biggs",1
"JohnFarson",1,1,148986,Revan Offense,"zzzJKR zzGMY zzHYoda zJolee zJKA",1
"JohnFarson",1,0,147753,ShaakClones,"zzShaak Ti, zRex zEcho (501st), zzFives zARC Trooper",1
"JohnFarson",1,1,85693,Ewoks,"zChirpa Elder Paploo Scout zLogray",1
"JohnFarson",0,1,149891,BH,"zzBossk zzJango zDengar zZam zFennec Shand",1
"JohnFarson",1,0,122462,Troopers,"zVeers zStarck zDark Trooper, zzGideon zStormtrooper",1
"JohnFarson",0,1,81951,Phoenix,"zHera zEzra Kanan G8, Zeb G8, Sabine G8",1
"JohnFarson",,,127590,Bad Batch,"zHunter zEcho zzOmega zTech zWrecker",1
"JohnFarson",1,0,23487,SionSolo (Counter),"zSion",1
"JohnFarson",,,152778,JMLS,"zBS zzzzzzJMLS zWat Tambor, zzJKL zBarriss",0
"JohnFarson",0,1,95207,Geonosians Omicron,"zzGBA Sun Fac, Geo Soldier, Geo Spy, Poggle",0
"JohnFarson",1,1,90238,Carth,"zCarth Onasi, zMission Zaalbar zJuhani Canderous G7",0
"JohnFarson",,,73867,Iden Troopers,"zIden Versio, Shoretrooper G7, Snowtrooper G8, Magma zDT",0
"JohnFarson",1,0,120612,zMaul,"Darth Maul, zSidious zSavage Sith Empire Trooper, Sith Marauder",0
"JohnFarson",1,0,64705,Jawas,"Nebit G4, Jawa Engineer G5, Jawa Scavenger G4, Jawa Dathcha G6",0
"Fitzdorf",,,168328,JMK,"zzzzzzJMK zJKA zzGMY zzShaak Ti, zGK",1
"Fitzdorf",,,166257,SEE,"zzzzzzSEE zBSF zzMalak zzzDR zzzVader",1
"Fitzdorf",,,132192,Grievous Omicron,"zzGG zB2 zB1 zMagnaGuard zDroideka",1
"Fitzdorf",0,1,103274,Geonosians Omicron,"zzGBA Sun Fac, Geo Soldier, Geo Spy, Poggle",1
"Fitzdorf",,,515197,Negotiator,"Negotiator HT Anakin's Eta-2, Umbaran SF, Ahsoka's SF, Clone Sergeant's ARC-170, Plo's SF, Rex's ARC-170",1
"Fitzdorf",,,434183,HansMF,"Home One, Han's MF, Biggs X-wing, Bistan's U-wing, Phantom Ghost Cassian's U-wing, Wedge X-wing",1
"Fitzdorf",1,1,125494,JTR,"zzzJTR zScav Rey, zzBB-8 zzR2-D2 zFinn",1
"Fitzdorf",1,1,127077,GAS,"zzzzGAS zRex zEcho (501st), zzFives zARC Trooper",1
"Fitzdorf",1,0,152281,CLS,"zzzCLS zHan zzChewbacca zzThrawn zzC-3PO",1
"Fitzdorf",1,1,97964,Ewoks,"zChirpa Elder zPaploo Wicket Logray G8",1
"Fitzdorf",0,1,132181,BH,"zzBossk zzJango Cad zBoba zDengar",1
"Fitzdorf",1,1,94885,Carth,"Carth Onasi, Mission G9, zZaalbar zJuhani zCanderous",1
"Fitzdorf",0,1,100428,FO,"zzKRU zKylo zPhasma FOO FOST",1
"Fitzdorf",0,1,81825,Phoenix,"Hera Ezra Kanan G8, Zeb Chopper",1
"Fitzdorf",1,0,127101,zMaul,"zDarth Maul, zDooku zSidious Sith Empire Trooper, Sith Marauder",1
"Fitzdorf",1,0,124415,EP (Counter, Rebel),"zzEP zKrennic DT G9, zzWampa zStarck",1
"Fitzdorf",1,0,85076,Jawas,"Nebit Jawa Engineer, Jawa Scavenger, Jawa Dathcha",1
"Fitzdorf",1,0,18889,SionSolo (Counter),"Sion",1
"Fitzdorf",,,72540,Admiral Raddus,"Admiral Raddus 3* G9, Cassian Jyn K-2SO G9, Chirrut G8",0
"Fitzdorf",1,1,90766,NestSisters,"zzAV MT Daka Zombie Nest 6* G8",0
"Fitzdorf",,,132389,JKL,"zJKL zzzJKR zzHYoda zzOld Ben, Aayla",0
"Fitzdorf",1,0,80271,Troopers,"zVeers zzPiett Gideon 6* G8, Dark Trooper 6* G7, Range Trooper 5* G8",0
"Fitzdorf",,,93564,Mon Mothma,"Mon Mothma 6* G9, Wedge Cara Dune, Biggs Lando",0
"Fitzdorf",,,37504,Bad Batch,"Hunter 5* G7, Echo 5* G8, Omega 5* G8, Tech 5* G8, Wrecker 5* G7",0
"QuinWindu",,,113350,Phasma,"zPhasma FOTP FOSFTP FOST Kylo",1
"QuinWindu",1,1,117547,JTR,"zJTR R2-D2 BB-8 RH Finn, RH Poe",1
"QuinWindu",,,494575,Raddus,"Raddus 6* Sun Fac SF, Rey's Millennium Falcon, Poe Dameron's X-wing, Resistance X-wing, Biggs X-wing, Wedge X-wing, Phantom Ghost",1
"QuinWindu",1,1,96944,Carth,"zCarth Onasi, Mission Zaalbar G9, Juhani Canderous",1
"QuinWindu",1,1,119282,zEP,"zEP zzVader zTarkin TFP G9, Sith Trooper",1
"QuinWindu",0,1,115066,Phoenix,"Hera Ezra Kanan Zeb Sabine",1
"QuinWindu",1,0,106563,Wiggs,"Wedge Biggs zCLS Han Leia",1
"QuinWindu",1,1,52471,Rogue1,"Jyn G8, Chirrut G8, Baze G8, K-2SO G9, Cassian G9",1
"QuinWindu",0,1,74040,padme,"Padme G8, GK G7, JKA Ahsoka Barriss G6",0
"QuinWindu",,,307119,Negotiator,"Negotiator 5* HT Anakin's Eta-2, Umbaran SF, Ahsoka's SF, BTL-B Y-wing 5*, Clone Sergeant's ARC-170, Plo's SF",0
"QuinWindu",0,1,52615,Geonosians Omicron,"GBA 6* G7, Sun Fac G6, Geo Soldier G8, Geo Spy G8, Poggle",0
"QuinWindu",0,1,68667,DR,"DR G8, HK-47 BSF Sith Assassin G6, Thrawn G8",0
"QuinWindu",1,1,84327,NS_Alt,"MT zAV Talia G9, Merrin Daka",0
"QuinWindu",1,1,81164,Ewoks,"Chirpa 4* G9, Elder Paploo G9, Wicket Logray",0
"QuinWindu",0,1,119713,BH,"Bossk The Mandalorian, Boba Greef Greedo",0
"QuinWindu",1,0,68796,Clones,"Cody G8, Rex Echo (501st) G8, Fives G8, Clone Sergeant",0
"QuinWindu",0,1,65018,BH,"Jango G7, IG-88 Cad Krrsantan G8, Boushh (Leia Organa) 6* G9",0
"QuinWindu",1,0,11811,SionSolo (Counter),"Sion G7",0
