Player,Offense,Defense,GP,Name,Squad,Viable
"Jayskywalker",0,1,128897,Grievous,"zzGG zB2 zB1 zMagnaGuard zNute",1
"Jayskywalker",1,0,148883,Traya,"zzTraya zzDN zSion zzEP zzThrawn",1
"Jayskywalker",,,495263,Raddus,"Raddus 6* Sun Fac SF, Rey's Millennium Falcon, Poe Dameron's X-wing, Resistance X-wing, Biggs X-wing, Wedge X-wing, Phantom Ghost",1
"Jayskywalker",,,92784,Mon Mothma,"Mon Mothma, Wedge Baze Chirrut Biggs",1
"Jayskywalker",1,1,121586,GAS,"zzzzGAS zRex zEcho (501st), zzFives zARC Trooper",1
"Jayskywalker",1,1,143183,Revan Offense,"zzzJKR zzGMY zBS zJolee zzHYoda",1
"Jayskywalker",1,1,97125,Ewoks,"zChirpa Elder zPaploo zWicket zLogray",1
"Jayskywalker",1,1,112460,Carth,"zCarth Onasi, zMission zZaalbar zJuhani zCanderous",1
"Jayskywalker",0,1,112799,BH,"zzBossk Cad zBoba zDengar zGreedo",1
"Jayskywalker",0,1,110415,FO,"zzKRU zKylo FOE zHux zFOST",1
"Jayskywalker",0,1,73910,Phoenix,"zHera G9, Ezra Kanan G8, Zeb G8, Sabine G8",1
"Jayskywalker",0,1,87650,Geonosians Omicron,"zzGBA Sun Fac G9, Geo Soldier, Geo Spy G9, Poggle",0
"Jayskywalker",,,367947,Executrix,"Executrix Tie Adv, Emperor's Shuttle, TIE Reaper 6*, Imperial TIE Fighter, Gauntlet Starfighter, FOSF TIE Fighter 2*, FO TIE Fighter",0
"Jayskywalker",1,0,72162,Troopers,"Veers Starck G8, Magma G8, zDT G9, Shoretrooper",0
"Jayskywalker",1,0,43723,Jawas,"Nebit G6, Jawa Engineer G7, Jawa Scavenger G7, Jawa G5, Dathcha G7",0
"Jakuu Bombassa",,,179761,JMK,"zzzzzzJMK zAhsoka zzzCAT zzzzGAS zGK",1
"Jakuu Bombassa",,,181454,SEE,"zzzzzzSEE zBSF zzMalak zzzDR zzzVader",1
"Jakuu Bombassa",1,0,148051,CLS,"zzzCLS zHan zzChewbacca zzC-3PO zChewpio",1
"Jakuu Bombassa",1,1,107013,NestSisters,"zzAV zzMT zDaka Zombie zNest",1
"Jakuu Bombassa",,,309338,Malevolence,"Malevolence Hyena Bomber, Vulture Droid, Sun Fac SF, Soldier SF, Spy SF",1
"Jakuu Bombassa",,,143487,JKL,"zzJKL zzzJKR zzHYoda zzOld Ben, Aayla",1
"Jakuu Bombassa",,,455343,HansMF,"Home One, Han's MF, Rebel Y-wing, Bistan's U-wing, Phantom Ghost Cassian's U-wing, Wedge X-wing",1
"Jakuu Bombassa",,,501505,Negotiator,"Negotiator HT Anakin's Eta-2, Umbaran SF, Ahsoka's SF, Clone Sergeant's ARC-170, Plo's SF, Rex's ARC-170",1
"Jakuu Bombassa",1,1,138638,JTR,"zzzJTR zzR2-D2 zzBB-8 zRH Finn, zRH Poe",1
"Jakuu Bombassa",0,1,124460,Grievous,"zzGG zB2 zB1 zMagnaGuard zNute",1
"Jakuu Bombassa",1,0,126767,Traya,"zzTraya zzDN zSion Sith Empire Trooper, zzThrawn",1
"Jakuu Bombassa",,,103342,Mon Mothma,"zzMon Mothma, Hoth Rebel Scout, Wedge zCara Dune, Biggs",1
"Jakuu Bombassa",1,1,96259,Ewoks,"zChirpa Elder zPaploo zWicket zLogray",1
"Jakuu Bombassa",1,1,112950,Carth,"zCarth Onasi, zMission zZaalbar zVandor Chewbacca, zCanderous",1
"Jakuu Bombassa",0,1,133857,BH,"zzBossk zzJango Cad zBoba zDengar",1
"Jakuu Bombassa",1,0,121274,Troopers,"zVeers zStarck zzPiett zDT zzGideon",1
"Jakuu Bombassa",0,1,96450,FO,"zzKRU zKylo FOO zHux zFOST",1
"Jakuu Bombassa",0,1,101715,Phoenix,"zHera zEzra zZeb zSabine zCaptain Rex",1
"Jakuu Bombassa",1,0,118902,zMaul,"zDarth Maul, zDooku zSidious Sith Assassin, zSavage",1
"Jakuu Bombassa",1,1,82648,Rogue1,"zzJyn Chirrut G9, Baze G8, zK-2SO Cassian G8",1
"Jakuu Bombassa",1,0,118202,EP (Counter, Rebel),"zzEP Shoretrooper G9, zKrennic zzWampa zStormtrooper",1
"Jakuu Bombassa",1,0,89478,Jawas,"Nebit Jawa Engineer, Jawa Scavenger, Jawa Dathcha",1
"Jakuu Bombassa",0,1,97640,Geonosians Omicron,"zzGBA Sun Fac, Geo Soldier, Geo Spy, Poggle",0
"Jakuu Bombassa",,,461393,Executrix,"Executrix Tie Adv, Emperor's Shuttle, TIE Reaper 3*, Imperial TIE Fighter, Gauntlet Starfighter, FOSF TIE Fighter, FO TIE Fighter",0
"Jakuu Bombassa",1,0,112663,ShaakClones,"zzShaak Ti, zRex zEcho (501st) G7, zzFives Clone Sergeant",0
"Agent P",,,177659,JMK,"zzzzzzJMK zAhsoka zzzCAT zzzzGAS zGK",1
"Agent P",1,1,159685,SL Kylo,"zzzzzzSL Kylo, zSith Trooper, zHux zzKRU zzThrawn",1
"Agent P",,,170830,Jabba,"zzzzzzJabba zBoushh (Leia Organa), zSkiff Guard (Lando Calrissian), Krrsantan zBoba",1
"Agent P",,,145528,SK,"zzEP zzMara Jade, The Emperor's Hand, zzStarkiller zzOld Ben, zVisas",1
"Agent P",,,574420,Executor,"Executor HT RC Xanadu Blood, Slave I, IG-2000 Imperial TIE Fighter, Tie Adv",1
"Agent P",1,0,160518,CLS,"zzzCLS zHan zzChewbacca zzC-3PO zChewpio",1
"Agent P",0,1,121102,DRMalak,"zzzDR zzHK-47 zBSF zzMalak Sith Empire Trooper",1
"Agent P",1,1,104547,NestSisters,"zzAV zzMT zDaka Zombie zNest",1
"Agent P",,,502452,Negotiator,"Negotiator BTL-B Y-wing, Anakin's Eta-2, Rex's ARC-170, Umbaran SF, Ahsoka's SF, Plo's SF, Clone Sergeant's ARC-170",1
"Agent P",,,329397,Malevolence,"Malevolence Hyena Bomber, Vulture Droid, Sun Fac SF, Soldier SF, Spy SF",1
"Agent P",0,1,113759,Geonosians Omicron,"zzGBA Sun Fac, Geo Soldier, Geo Spy, Poggle",1
"Agent P",,,493183,HansMF,"Home One, Han's MF, Rebel Y-wing, Bistan's U-wing, Phantom Ghost Cassian's U-wing, Wedge X-wing",1
"Agent P",1,1,122945,JTR,"zzzJTR zzR2-D2 zzBB-8 RH Finn G8, RH Poe G8",1
"Agent P",0,1,131887,Grievous,"zzGG zB2 zB1 zMagnaGuard zNute",1
"Agent P",1,0,114068,Traya,"zzTraya zDN zSion zDooku Sith Assassin",1
"Agent P",,,110796,Mon Mothma,"zzMon Mothma, Scarif Wedge zCara Dune, Biggs",1
"Agent P",1,1,143621,Revan Offense,"zzzJKR zzGMY zzHYoda zJolee zJKA",1
"Agent P",1,1,104180,Ewoks,"zChirpa Elder zPaploo zWicket zLogray",1
"Agent P",1,0,149700,ShaakClones,"zzShaak Ti, zRex zEcho (501st), zzFives zARC Trooper",1
"Agent P",1,1,95265,Carth,"zCarth Onasi, zMission zZaalbar Juhani Canderous",1
"Agent P",0,1,150598,BH,"zzBossk zzJango zDengar zFennec Shand, zzAurra",1
"Agent P",0,1,109603,Phoenix,"zHera Kanan Zeb Sabine zCaptain Rex",1
"Agent P",1,1,107806,Rogue1,"zzJyn Chirrut Baze zK-2SO zCassian",1
"Agent P",,,128952,Bad Batch,"zHunter zEcho zzOmega zTech zWrecker",1
"Agent P",1,0,90329,Jawas,"Nebit Jawa Engineer, Jawa Scavenger, Jawa Dathcha",1
"Agent P",,,123216,Phasma,"zPhasma zFOTP FOSFTP zFOST zKylo",0
"Agent P",,,153151,JMLS,"zBS zzzzzzJMLS zWat Tambor, zzJKL zBarriss",0
"Agent P",1,0,101974,Troopers,"Veers zzPiett zGideon zDark Trooper G9, Range Trooper G9",0
"Agent P",,,74385,Iden Troopers,"zIden Versio, Shoretrooper G9, Snowtrooper G8, Magma G9, DT",0
"Utinni",,,175454,SEE,"zzzzzzSEE zBSF zzMalak zzzDR zzzVader",1
"Utinni",,,181311,JMLS,"zzzJKR zzJKL zzzzzzJMLS zWat Tambor, zzzzGAS",1
"Utinni",1,0,152788,CLS,"zzzCLS zHan zzChewbacca zzC-3PO zChewpio",1
"Utinni",0,1,122089,padme,"zzPadme zGK zJKA zAhsoka CW Chewbacca G8",1
"Utinni",,,477078,Negotiator,"Negotiator HT Anakin's Eta-2, Umbaran SF, Ahsoka's SF, Clone Sergeant's ARC-170, Plo's SF, Rex's ARC-170",1
"Utinni",,,397757,HansMF,"Home One, Han's MF, Rebel Y-wing, Ghost Phantom Biggs X-wing, Cassian's U-wing, Wedge X-wing",1
"Utinni",0,1,133964,Grievous,"zzGG zB2 zDroideka zMagnaGuard zDooku",1
"Utinni",1,1,107266,JTR,"zzzJTR Scav Rey G8, BB-8 G8, zzR2-D2 Finn G8",1
"Utinni",,,112880,Mon Mothma,"zzMon Mothma, Wedge zCara Dune, Biggs Lando",1
"Utinni",1,0,118434,ShaakClones,"zzShaak Ti, zRex zEcho (501st), zzFives zARC Trooper",1
"Utinni",1,1,90629,Ewoks,"zChirpa Elder Paploo Teebo Wicket",1
"Utinni",0,1,106646,BH,"zzBossk Jango Cad zBoba Dengar",1
"Utinni",1,1,93065,Carth,"zCarth Onasi, zMission zZaalbar Juhani zCanderous",1
"Utinni",0,1,75934,Phoenix,"Hera G9, zEzra Kanan G9, Zeb Chopper",1
"Utinni",1,0,105282,Thragma (Counter),"zzThrawn Magma DT Krennic Tarkin",1
"Utinni",0,1,125973,BS,"zBS zzGMY zJolee Old Ben, zzHYoda",1
"Utinni",1,0,125016,EP (Counter, Rebel),"zzEP Shoretrooper zzWampa zNest Starck",1
"Utinni",1,0,72172,Jawas,"Nebit G8, Jawa Engineer, Jawa Scavenger, Jawa Dathcha G9",1
"Utinni",,,65259,Phasma,"Phasma G8, FOE G9, FOO zKRU G8, Kylo G8",0
"Utinni",0,1,97019,Geonosians Omicron,"zzGBA Sun Fac, Geo Soldier, Geo Spy, Poggle",0
"Utinni",1,0,7831,SionSolo (Counter),"Sion 3* G7",0
"GreenFire",,,172115,JMK,"zzzzzzJMK zAhsoka zzzCAT zzPadme zGK",1
"GreenFire",1,1,174119,SL Kylo,"zzzzzzSL Kylo, zSith Trooper, zHux zzKRU zzThrawn",1
"GreenFire",,,178865,SEE,"zzzzzzSEE zBSF zzMalak zzzDR zzzVader",1
"GreenFire",0,1,96335,Qira,"Qira L3-37 zVandor Chewbacca, Mission Zaalbar",1
"GreenFire",1,1,171097,GL Rey,"zzzzzzRey zzzJTR zzBB-8 zRH Poe, zRH Finn",1
"GreenFire",1,1,116133,NS,"zzMT zAV zDaka Zombie Spirit",1
"GreenFire",,,546132,Executor,"Executor 6* HT RC Xanadu Blood, Slave I, IG-2000 Imperial TIE Fighter, Tie Adv",1
"GreenFire",,,177699,JMLS,"zzzJKR zzJKL zzzzzzJMLS zWat Tambor, zzzzGAS",1
"GreenFire",1,0,145587,CLS,"zzzCLS zHan zzChewbacca zzC-3PO zChewpio",1
"GreenFire",,,504890,HansMF,"Home One, Han's MF, Rebel Y-wing, Bistan's U-wing, Phantom Ghost Cassian's U-wing, Wedge X-wing",1
"GreenFire",1,0,136870,Traya,"zzTraya zzDN zSion zzEP Sith Empire Trooper",1
"GreenFire",0,1,130453,Grievous,"zzGG zB2 zB1 zMagnaGuard Dooku",1
"GreenFire",,,104986,Mon Mothma,"zzMon Mothma, Scarif Hoth Rebel Scout, Cara Dune, zPao",1
"GreenFire",1,0,114825,Troopers,"zVeers zzPiett zGideon zDark Trooper, Range Trooper",1
"GreenFire",,,134009,Disintegration,"Aurra zzGreef zBoba zzBossk The Mandalorian",1
"GreenFire",1,1,106774,Ewoks,"zChirpa Elder Paploo Wicket Logray",1
"GreenFire",1,0,129936,ShaakClones,"zzShaak Ti, zRex zEcho (501st), zzFives zARC Trooper",1
"GreenFire",,,87415,Iden Troopers,"zIden Versio, Shoretrooper Snowtrooper Magma DT",1
"GreenFire",0,1,106846,Phoenix,"Hera Ezra Kanan Zeb Sabine",1
"GreenFire",1,1,95418,Rogue1,"Jyn Chirrut G8, Baze G8, K-2SO Cassian",1
"GreenFire",,,119943,Maul,"zzzMaul zBo-Katan Canderous Jango zArmorer",1
"GreenFire",0,1,137865,BS,"zBS zzGMY zJolee zzOld Ben, zzHYoda",1
"GreenFire",1,0,85217,Jawas,"Nebit Jawa Engineer, Jawa Scavenger, Jawa Dathcha",1
"GreenFire",1,0,16044,NestSolo (Counter),"Nest",1
"GreenFire",,,121408,Phasma,"Phasma FOTP FOSFTP zFOST zKylo",0
"GreenFire",,,478715,Negotiator,"Negotiator BTL-B Y-wing 4*, Anakin's Eta-2, Rex's ARC-170, Umbaran SF, Ahsoka's SF, Plo's SF, Clone Sergeant's ARC-170",0
"GreenFire",0,1,112069,Geonosians Omicron,"zzGBA Sun Fac, Geo Soldier, Geo Spy, Poggle",0
"GreenFire",1,0,116961,zMaul,"Darth Maul, zSidious Sith Assassin, zSavage Sith Marauder",0
"GreenFire",,,90032,Bad Batch,"zHunter zEcho Omega 5* G9, zTech zWrecker",0
"generalAthena",1,1,149116,NS,"zzMT zzAV zDaka Zombie Spirit",1
"generalAthena",0,1,136089,padme,"zzPadme zGK zJKA zAhsoka zzC-3PO",1
"generalAthena",0,1,117996,Geonosians Omicron,"zzGBA Sun Fac, Geo Soldier, Geo Spy, Poggle",1
"generalAthena",,,502235,HansMF,"Home One, Han's MF, Rebel Y-wing, Bistan's U-wing, Phantom Ghost Cassian's U-wing, Wedge X-wing",1
"generalAthena",,,529181,Negotiator,"Negotiator HT Anakin's Eta-2, Umbaran SF, Ahsoka's SF, Clone Sergeant's ARC-170, Plo's SF, Rex's ARC-170",1
"generalAthena",,,153751,Disintegration,"zzAurra zzGreef zBoba zzBossk zzThe Mandalorian",1
"generalAthena",,,114274,Nute-Wat,"zNute zDooku zWat Tambor, zzJango zNest",1
"generalAthena",1,1,116143,Ewoks,"zChirpa Elder zPaploo zWicket zLogray",1
"generalAthena",1,0,118914,ShaakClones,"zzShaak Ti, zRex zEcho (501st), zzFives Clone Sergeant",1
"generalAthena",1,1,167056,zEP,"zzEP zzzVader zzTarkin TFP G9, zzTraya",1
"generalAthena",0,1,147329,Phoenix,"zHera zEzra zKanan zZeb zSabine",1
"generalAthena",1,0,103693,Wiggs,"Wedge Biggs G9, zzChewbacca zFulcrum zLeia",1
"generalAthena",0,1,106809,FO,"zzKRU zKylo zPhasma zHux 5* zFOTP",1
"generalAthena",1,0,95308,Jawas,"Nebit Jawa Engineer, Jawa Scavenger, Jawa Dathcha",1
"generalAthena",1,0,21892,SionSolo (Counter),"zSion",1
"generalAthena",0,1,62331,Qira,"Qira G9, zL3-37 6* Vandor Chewbacca 4* G7, Mission 5* G7, zZaalbar 4* G9",0
"generalAthena",,,84364,Grievous Omicron,"zzGG B2 G5, zB1 MagnaGuard G5, Droideka G8",0
"generalAthena",,,105913,Mon Mothma,"zzMon Mothma 6* G9, zK-2SO zCassian zCara Dune, zzJyn",0
"generalAthena",,,62591,Iden Troopers,"Iden Versio 5* G8, Shoretrooper G8, Snowtrooper G6, Magma G7, zDT G4",0
"generalAthena",1,0,51981,Troopers,"Veers G8, Starck G7, Range Trooper 6* G3, Gideon 6* G8, Stormtrooper G5",0
"generalAthena",0,1,103862,BS,"zBS zzGMY Aayla G6, zzOld Ben, HYoda 6* G2",0
"Mr Hazer",0,1,127076,padme,"zzPadme zGK zJKA zAhsoka zzC-3PO",1
"Mr Hazer",1,1,104774,NestSisters,"zzAV zzMT zDaka Zombie zNest",1
"Mr Hazer",,,445507,Negotiator,"Negotiator HT Anakin's Eta-2, Umbaran SF, Ahsoka's SF, BTL-B Y-wing, Clone Sergeant's ARC-170, Plo's SF",1
"Mr Hazer",0,1,118541,DR,"zzzDR zzHK-47 zBSF Sith Empire Trooper, Sith Assassin",1
"Mr Hazer",,,439578,HansMF,"Home One, Han's MF, Rebel Y-wing, Bistan's U-wing, Phantom Ghost Cassian's U-wing, Wedge X-wing",1
"Mr Hazer",1,0,133033,Traya,"zzTraya zzDN zSion zzEP zzThrawn",1
"Mr Hazer",0,1,94597,Grievous-Wat,"zzGG zB2 G9, zB1 G9, zMagnaGuard G9, zWat Tambor",1
"Mr Hazer",1,1,113334,JTR,"zzzJTR zScav Rey, zzBB-8 zzR2-D2 RT",1
"Mr Hazer",,,487557,Executrix,"Executrix Tie Adv, Emperor's Shuttle, TIE Reaper, Imperial TIE Fighter, Gauntlet Starfighter, FOSF TIE Fighter, FO TIE Fighter",1
"Mr Hazer",,,127247,Disintegration,"zzAurra zzGreef zBoba zzBossk zzThe Mandalorian",1
"Mr Hazer",,,93415,Mon Mothma,"zzMon Mothma, Hoth Rebel Scout, Wedge Baze Biggs",1
"Mr Hazer",,,114376,Nute-OR,"zNute zDooku zzJango zZaalbar zMission",1
"Mr Hazer",1,1,137759,Revan Offense,"zzzJKR zzGMY zBS zJolee zzHYoda",1
"Mr Hazer",1,1,96784,Ewoks,"zChirpa Elder zPaploo zWicket zLogray",1
"Mr Hazer",1,0,108344,ShaakClones,"zzShaak Ti, zRex zEcho (501st), zzFives zARC Trooper",1
"Mr Hazer",0,1,110555,FO,"zzKRU zKylo FOE zHux zFOST",1
"Mr Hazer",1,0,128938,CLS,"zzzCLS zHan zLeia zzOld Ben, zzChewbacca",1
"Mr Hazer",0,1,98309,Phoenix,"zHera zEzra zKanan zZeb zSabine",1
"Mr Hazer",,,274283,Malevolence,"Malevolence Hyena Bomber 4*, Vulture Droid, Sun Fac SF, Soldier SF, Spy SF",0
"Mr Hazer",0,1,96436,Geonosians Omicron,"zzGBA Sun Fac, Geo Soldier, Geo Spy, Poggle",0
"Mr Hazer",1,0,102262,Troopers,"zVeers zStarck zDT zzGideon Shoretrooper",0
"Cfood69",,,177815,JMK,"zzzzzzJMK zJKA zzGMY zzShaak Ti, zGK",1
"Cfood69",,,123281,Phasma,"zPhasma zFOTP FOSFTP zFOST zKylo",1
"Cfood69",1,1,164440,SL Kylo,"zzzzzzSL Kylo, zSith Trooper, zHux zzKRU zzThrawn",1
"Cfood69",,,164921,SEE,"zzzzzzSEE zBSF zzMalak zzzDR zzzVader",1
"Cfood69",,,158125,Jabba,"zzzzzzJabba zBoushh (Leia Organa), zSkiff Guard (Lando Calrissian), Krrsantan zBoba",1
"Cfood69",1,1,103109,NS,"zzMT zzAV zDaka Zombie Spirit",1
"Cfood69",,,176772,JMLS,"zzzJKR zzJKL zzzzzzJMLS zWat Tambor, zzzzGAS",1
"Cfood69",1,0,152385,CLS,"zzzCLS zHan zzChewbacca zzC-3PO zChewpio",1
"Cfood69",,,496887,Negotiator,"Negotiator HT Anakin's Eta-2, Umbaran SF, Ahsoka's SF, BTL-B Y-wing, Clone Sergeant's ARC-170, Plo's SF",1
"Cfood69",,,435987,HansMF,"Home One, Han's MF, Rebel Y-wing, Bistan's U-wing, Phantom Ghost Cassian's U-wing, Wedge X-wing",1
"Cfood69",1,1,114646,JTR,"zzzJTR zzR2-D2 BB-8 RH Finn G9, RH Poe",1
"Cfood69",0,1,127128,Grievous,"zzGG zB2 zB1 zMagnaGuard zNute",1
"Cfood69",1,0,124586,Traya,"zzTraya zzDN zSion zzEP Sith Empire Trooper",1
"Cfood69",,,112113,Mon Mothma,"zzMon Mothma, Hoth Rebel Scout, Wedge zCara Dune, Biggs",1
"Cfood69",1,1,86747,Ewoks,"zChirpa Elder Paploo Wicket zLogray",1
"Cfood69",1,1,101715,Carth,"zCarth Onasi, zMission zZaalbar zJuhani zCanderous",1
"Cfood69",0,1,152213,BH,"zzBossk zzJango zDengar zFennec Shand, zzAurra",1
"Cfood69",1,0,115431,501st,"zRex zARC Trooper, zEcho (501st), zzFives zAhsoka",1
"Cfood69",1,0,123521,Troopers,"zVeers zStarck zzPiett DT zzGideon",1
"Cfood69",1,0,127368,zMaul,"zDarth Maul, zSidious zDooku Sith Marauder, zNest",1
"Cfood69",0,1,95290,Phoenix,"Hera zEzra zKanan zZeb Sabine G8",1
"Cfood69",1,1,67454,Rogue1,"Jyn G8, Chirrut G8, Baze G8, K-2SO G9, Cassian G9",1
"Cfood69",1,0,82529,Jawas,"Nebit G9, Jawa Engineer, Jawa Scavenger, Jawa Dathcha G9",1
"Cfood69",,,323416,Malevolence,"Malevolence Hyena Bomber 5*, Vulture Droid, Sun Fac SF, Soldier SF, Spy SF",0
"Cfood69",0,1,107202,Geonosians Omicron,"zzGBA Sun Fac, Geo Soldier, Geo Spy, Poggle",0
"Cfood69",,,482925,Executrix,"Executrix Tie Adv, Emperor's Shuttle, TIE Reaper 4*, Imperial TIE Fighter, Gauntlet Starfighter, FOSF TIE Fighter, FO TIE Fighter",0
"Cfood69",,,64743,Bad Batch,"Hunter G9, Echo G9, Omega 6* G8, zTech Wrecker G8",0
"Quí Gón Jöhn",,,588332,Executor,"Executor HT RC Xanadu Blood, Slave I, IG-2000 Imperial TIE Fighter, Tie Adv",1
"Quí Gón Jöhn",0,1,114177,DRMalak,"zzzDR zHK-47 zBSF zzMalak Sith Empire Trooper",1
"Quí Gón Jöhn",1,0,120528,Traya,"zzTraya DN G9, zSion zzEP zThrawn",1
"Quí Gón Jöhn",1,1,81304,JTR,"zJTR G9, Scav Rey, zBB-8 G9, zR2-D2 G8, Finn G8",1
"Quí Gón Jöhn",1,0,114092,Troopers,"zVeers zzPiett zGideon zDark Trooper, Range Trooper",1
"Quí Gón Jöhn",1,1,111823,Revan,"zzzJKR zBS zGMY zJolee GK",1
"Quí Gón Jöhn",1,1,79664,Ewoks,"zChirpa Elder Paploo G9, Scout Logray",1
"Quí Gón Jöhn",0,1,137191,BH,"zzBossk IG-88 Cad zBoba Dengar",1
"Quí Gón Jöhn",1,1,85059,Carth,"zCarth Onasi, zMission zZaalbar Juhani G8, Canderous",1
"Quí Gón Jöhn",0,1,91483,Phoenix,"Hera zEzra zKanan G9, zSabine zzCaptain Rex",1
"Quí Gón Jöhn",1,0,14931,NestSolo (Counter),"Nest G9",1
"Quí Gón Jöhn",,,75977,Phasma,"Phasma G7, zFOTP FOO G7, zKRU zKylo G7",0
"Quí Gón Jöhn",,,71463,Grievous Omicron,"zGG G9, B2 G9, B1 G7, MagnaGuard G8, Droideka G8",0
"Quí Gón Jöhn",1,0,88824,CLS,"zzCLS zHan G9, zChewbacca G9, C-3PO 5* G8, zChewpio",0
"Quí Gón Jöhn",0,1,70607,Geonosians Omicron,"zGBA G9, Sun Fac G8, Geo Soldier, Geo Spy G8, Poggle",0
"Quí Gón Jöhn",,,306755,HansMF,"Home One, Han's MF, Rebel Y-wing 5*, Bistan's U-wing, Phantom Ghost Cassian's U-wing, Biggs X-wing",0
"Quí Gón Jöhn",1,1,58011,NS,"MT 5* AV G8, Daka G9, Zombie G9, Spirit G7",0
"Quí Gón Jöhn",1,0,63401,ShaakClones,"Shaak Ti G8, Rex G7, Echo (501st) G7, Fives G8, Clone Sergeant G8",0
"Quí Gón Jöhn",,,69675,Iden Troopers,"zIden Versio G9, Stormtrooper Snowtrooper G8, Magma G9, DT G8",0
"Quí Gón Jöhn",1,0,81367,zMaul,"Darth Maul, Dooku Sidious zSavage Sith Marauder",0
"TinyToebeans",1,1,98173,NS,"zzMT zAV zDaka Zombie Spirit",1
"TinyToebeans",0,1,121731,padme,"zzPadme zGK zJKA zAhsoka zC-3PO",1
"TinyToebeans",0,1,95088,Geonosians Omicron,"zzGBA Sun Fac, Geo Soldier, Geo Spy, Poggle",1
"TinyToebeans",,,447974,Negotiator,"Negotiator HT Anakin's Eta-2, Umbaran SF, Ahsoka's SF, Clone Sergeant's ARC-170, Jedi Consular's Starfighter, Plo's SF",1
"TinyToebeans",0,1,108986,Grievous,"zzGG zB2 zB1 MagnaGuard zNute",1
"TinyToebeans",1,1,108779,GAS,"zzzGAS zRex Echo (501st), zzFives zARC Trooper",1
"TinyToebeans",1,1,124410,zEP,"zzEP zzVader Tarkin zSith Trooper, zzTraya",1
"TinyToebeans",0,1,131273,FO,"zzKRU zKylo FOO FOE zHux",1
"TinyToebeans",0,1,106539,Phoenix,"Hera Ezra zKanan Zeb Sabine",1
"TinyToebeans",,,266648,Malevolence,"Malevolence Hyena Bomber 4*, Vulture Droid 6*, Sun Fac SF, Soldier SF, Spy SF",0
"TinyToebeans",0,1,86577,BH,"Bossk IG-88 6* G8, Cad Boba Greedo 5* G8",0
"TinyToebeans",1,0,73507,Wiggs,"Wedge Biggs Leia Chirrut 5* G8, Baze 5* G8",0
"DemToeBeanz",,,431108,Profundity,"Profundity 5* Han's MF, Outrider Rebel Y-wing, Cassian's U-wing, Ghost",1
"DemToeBeanz",1,1,120613,NS,"zzMT zzAV zDaka Zombie Spirit",1
"DemToeBeanz",,,605783,Executor,"Executor HT RC Xanadu Blood, Slave I, IG-2000 Gauntlet Starfighter, Tie Adv",1
"DemToeBeanz",0,1,147843,padme,"zzPadme zGK zJKA zAhsoka zzzCAT",1
"DemToeBeanz",1,0,143469,CLS,"zzzCLS zHan zzChewbacca zzC-3PO zChewpio",1
"DemToeBeanz",0,1,131620,DRMalak,"zzzDR zzHK-47 zBSF zzMalak Sith Empire Trooper",1
"DemToeBeanz",,,478862,Negotiator,"Negotiator BTL-B Y-wing, Anakin's Eta-2, Rex's ARC-170, Umbaran SF, Ahsoka's SF, Plo's SF, Clone Sergeant's ARC-170",1
"DemToeBeanz",,,334216,Malevolence,"Malevolence Hyena Bomber, Vulture Droid, Sun Fac SF, Soldier SF, Spy SF",1
"DemToeBeanz",0,1,112428,Geonosians Omicron,"zzGBA Sun Fac, Geo Soldier, Geo Spy, Poggle",1
"DemToeBeanz",,,146394,JKL,"zzJKL zzzJKR zzHYoda zzOld Ben, Ezra",1
"DemToeBeanz",1,1,132511,JTR,"zzzJTR zzR2-D2 zzBB-8 zRH Finn, zRH Poe",1
"DemToeBeanz",0,1,139614,Grievous,"zzGG zB2 zB1 zMagnaGuard zNute",1
"DemToeBeanz",1,0,137204,Traya,"zzTraya zDN zSion zzEP zzThrawn",1
"DemToeBeanz",,,108062,Mon Mothma,"zzMon Mothma, Scarif Hoth Rebel Scout, zCara Dune, zPao",1
"DemToeBeanz",1,0,115256,Troopers,"zVeers zzPiett zzGideon zDark Trooper, Range Trooper",1
"DemToeBeanz",,,143456,Disintegration,"zAurra zzGreef zBoba zzBossk zThe Mandalorian",1
"DemToeBeanz",1,1,124265,GAS,"zzzzGAS zRex zEcho (501st), zzFives zARC Trooper",1
"DemToeBeanz",1,1,95958,Ewoks,"zChirpa Elder zPaploo zWicket zLogray",1
"DemToeBeanz",1,1,109529,Carth,"zCarth Onasi, zMission Zaalbar zVandor Chewbacca, zCanderous",1
"DemToeBeanz",,,97054,Iden Troopers,"zIden Versio, zStormtrooper Snowtrooper Magma DT",1
"DemToeBeanz",0,1,127137,Phoenix,"zHera zKanan Zeb zSabine zzCaptain Rex",1
"DemToeBeanz",1,1,102588,Rogue1,"zJyn Chirrut G8, Baze G8, zK-2SO zCassian",1
"DemToeBeanz",,,131456,Bad Batch,"zHunter zEcho zzOmega zTech zWrecker",1
"DemToeBeanz",,,124777,Mando,"zzThe Mandalorian (Beskar Armor), zDash Rendar, zNest zIG-11 zKuiil",1
"DemToeBeanz",1,0,85195,Jawas,"Nebit Jawa Engineer, Jawa Scavenger, Jawa Dathcha",1
"DemToeBeanz",,,115600,Phasma,"Phasma FOTP FOSFTP FOST zKylo",0
"DemToeBeanz",0,1,135454,BH,"zJango zIG-88 Cad zDengar zFennec Shand",0
"DemToeBeanz",1,0,102236,zMaul,"Darth Maul, zDooku Sith Assassin, zSavage Sith Marauder",0
"Mando Kast",0,1,141600,padme,"zzPadme zGK zJKA zAhsoka zzC-3PO",1
"Mando Kast",0,1,90360,Geonosians Omicron,"zzGBA Sun Fac, Geo Soldier, Geo Spy, Poggle",1
"Mando Kast",,,426080,Negotiator,"Negotiator HT Anakin's Eta-2, Umbaran SF, Ahsoka's SF, Clone Sergeant's ARC-170, Plo's SF, Rex's ARC-170",1
"Mando Kast",,,329770,HansMF,"Home One, Han's MF, Biggs X-wing, Bistan's U-wing, Phantom Ghost Cassian's U-wing, Wedge X-wing",1
"Mando Kast",0,1,93314,Grievous-Wat,"zGG zB2 zB1 MagnaGuard zWat Tambor 5*",1
"Mando Kast",,,111720,Disintegration,"zAurra zzGreef zBoba zzBossk The Mandalorian",1
"Mando Kast",1,1,96891,GAS,"zzzzGAS Rex zEcho (501st), Fives ARC Trooper",1
"Mando Kast",1,1,115788,Revan Offense,"zzzJKR GMY BS zJolee zzHYoda",1
"Mando Kast",1,1,90917,Ewoks,"zChirpa Elder Paploo Scout zWicket",1
"Mando Kast",1,1,96999,Carth,"Carth Onasi, zMission zZaalbar Juhani Canderous",1
"Mando Kast",0,1,81932,Phoenix,"zHera Ezra G9, zKanan zZeb Sabine G8",1
"Mando Kast",1,0,98777,ThrawnTroopers,"zThrawn Range Trooper, zDT Shoretrooper G9, zVeers",1
"Mando Kast",1,0,79617,EP (Counter, Rebel),"zEP Krennic G8, zzWampa Nest G9, Stormtrooper G8",1
"Mando Kast",1,0,10276,SionSolo (Counter),"Sion G9",1
"Mando Kast",,,56486,Phasma,"Phasma G9, FOTP FOSFTP G8, FOST G9, Kylo G8",0
"Mando Kast",,,46653,Admiral Raddus,"Admiral Raddus G7, Cassian G7, Jyn G9, Baze G7, Chirrut G8",0
"Mando Kast",1,1,84185,NS,"zzMT zzAV Daka Zombie Spirit G7",0
"Mando Kast",1,0,104967,CLS,"zzzCLS zHan zzChewbacca R2-D2 G8, Chewpio G8",0
"Mando Kast",0,1,91049,DRMalak,"zzzDR HK-47 zBSF Malak G9, Sith Assassin G7",0
"Mando Kast",,,74855,Mon Mothma,"zMon Mothma G9, Wedge G8, zCara Dune, Kyle Katarn G9, Lando",0
"Mando Kast",0,1,90671,BH,"zJango Embo Dengar Greedo Fennec Shand",0
"Mando Kast",,,50979,Bad Batch,"Hunter G9, Echo 5* G9, Omega G9, Tech G9, Wrecker 6* G8",0
"Mando Kast",1,0,47639,Jawas,"Nebit G8, Jawa Engineer G7, Jawa Scavenger G7, Jawa G7, Dathcha G8",0
"Project Chaos",1,1,174079,GL Rey,"zzzzzRey zzzJTR zzBB-8 zHoldo zRH Finn",1
"Project Chaos",0,1,152055,padme,"zzPadme zGK zJKA zAhsoka zzzCAT",1
"Project Chaos",0,1,151100,DRMalak,"zzzDR zzHK-47 zBSF zzMalak Sith Empire Trooper",1
"Project Chaos",,,494205,Negotiator,"Negotiator BTL-B Y-wing, Anakin's Eta-2, Rex's ARC-170, Umbaran SF, Ahsoka's SF, Plo's SF, Clone Sergeant's ARC-170",1
"Project Chaos",,,405662,HansMF,"Home One, Han's MF, Rebel Y-wing, Ghost Phantom Biggs X-wing, Cassian's U-wing, Wedge X-wing",1
"Project Chaos",0,1,116922,Grievous,"zzGG zB2 zB1 zMagnaGuard zNute",1
"Project Chaos",1,0,142221,Traya,"zzTraya zDN zSion zzEP zThrawn",1
"Project Chaos",1,0,135211,CLS,"zzzCLS zHan zzChewbacca zzR2-D2 zzC-3PO",1
"Project Chaos",,,129371,Disintegration,"Aurra zzGreef zBoba zzBossk zzThe Mandalorian",1
"Project Chaos",1,1,152302,GAS,"zzzzGAS zRex zEcho (501st), zzFives zARC Trooper",1
"Project Chaos",1,1,134359,Revan Offense,"zzzJKR zGMY zBS zJolee zzHYoda",1
"Project Chaos",1,1,94561,Ewoks,"zChirpa Elder zPaploo zWicket zLogray",1
"Project Chaos",1,1,106627,Carth,"zCarth Onasi, zMission zZaalbar zJuhani zCanderous",1
"Project Chaos",0,1,125265,FO,"zzKRU zKylo FOE zHux FOST",1
"Project Chaos",1,0,92549,Wiggs,"Wedge Biggs zFulcrum zEzra Leia",1
"Project Chaos",0,1,88822,Phoenix,"zHera zKanan G9, zZeb G9, Sabine G8, zCaptain Rex",1
"Project Chaos",1,1,70784,Rogue1,"Jyn G8, Chirrut G9, Baze G8, K-2SO G8, Cassian G8",1
"Project Chaos",1,0,19894,NestSolo (Counter),"zNest",1
"Project Chaos",,,291553,Malevolence,"Malevolence Hyena Bomber 5*, Vulture Droid, Sun Fac SF, Soldier SF, Spy SF",0
"Project Chaos",0,1,96319,Geonosians Omicron,"zzGBA Sun Fac, Geo Soldier, Geo Spy, Poggle",0
"Project Chaos",1,1,73938,NS,"MT G8, zAV Daka G9, Zombie 6* G8, Spirit 6* G8",0
"Project Chaos",,,99979,Mon Mothma,"Mon Mothma G9, Cara Dune, zKyle Katarn, Pao G9, Lando",0
"Project Chaos",,,81382,Iden Troopers,"zIden Versio, Stormtrooper Snowtrooper Magma G8, DT",0
"Project Chaos",1,0,79604,Troopers,"Veers G8, Starck zzPiett Gideon G9, Shoretrooper G9",0
"Project Chaos",0,1,85301,BH,"zJango IG-88 Cad Greedo G8, Fennec Shand G8",0
"Project Chaos",1,0,100947,zMaul,"Darth Maul, zDooku zSidious zSavage Sith Marauder",0
"Project Chaos",,,82308,Bad Batch,"zHunter Echo Omega G9, Tech Wrecker",0
"Ashtray",,,125681,Phasma,"zPhasma zFOTP FOSFTP zFOST zKylo",1
"Ashtray",1,1,162111,SL Kylo,"zzzzzzSL Kylo, zSith Trooper, zHux zzKRU zThrawn",1
"Ashtray",,,159990,SEE,"zzzzzzSEE zBSF zzMalak zzzDR zzzVader",1
"Ashtray",1,1,168074,GL Rey,"zzzzzzRey zzzJTR zzR2-D2 zRH Poe, zRH Finn",1
"Ashtray",,,163705,Jabba,"zzzzzzJabba zBoushh (Leia Organa), zSkiff Guard (Lando Calrissian), Krrsantan zBoba",1
"Ashtray",,,164314,JMLS,"zzzJKR zzJKL zzzzzzJMLS zWat Tambor, zzzzGAS",1
