Player,Offense,Defense,GP,Name,Squad,Viable
"Ashtray",1,0,150823,CLS,"zzzCLS zHan zzChewbacca zzC-3PO zChewpio",1
"Ashtray",1,1,109439,NestSisters,"zzAV zzMT zDaka Zombie zNest",1
"Ashtray",0,1,117888,padme,"zzPadme zGK zJKA zAhsoka zBarriss",1
"Ashtray",,,429954,HansMF,"Home One, Han's MF, Rebel Y-wing, Bistan's U-wing, Phantom Biggs X-wing, Cassian's U-wing, Wedge X-wing",1
"Ashtray",,,452890,Negotiator,"Negotiator HT Anakin's Eta-2, Umbaran SF, Ahsoka's SF, Clone Sergeant's ARC-170, Plo's SF, Rex's ARC-170",1
"Ashtray",1,0,108297,Traya,"zzTraya zDN Sion G9, zzEP Sith Empire Trooper",1
"Ashtray",0,1,115604,Grievous,"zzGG zB2 zB1 zDroideka zDooku",1
"Ashtray",,,113887,Mon Mothma,"zMon Mothma, Wedge zSaw Gerrera, Biggs Lando",1
"Ashtray",1,1,82631,Ewoks,"zChirpa Elder Paploo Wicket Logray",1
"Ashtray",1,1,97340,Carth,"zCarth Onasi, zMission zZaalbar zVandor Chewbacca, Canderous",1
"Ashtray",0,1,146250,BH,"zzBossk zDengar zGreedo zFennec Shand, zzAurra",1
"Ashtray",1,0,122095,Troopers,"zVeers zStarck Range Trooper, zzPiett zzGideon",1
"Ashtray",1,0,121205,Wampa (Counter),"zRex zzWampa Krennic zzHYoda FOO",1
"Ashtray",0,1,74579,Phoenix,"Hera G9, Ezra Kanan G8, Zeb G8, Sabine",1
"Ashtray",1,0,75778,Jawas,"Nebit G8, Jawa Engineer G9, Jawa Scavenger G8, Jawa Dathcha G9",1
"Ashtray",,,66987,Admiral Raddus,"Admiral Raddus 3* G8, Cassian G8, Jyn K-2SO G9, Chirrut G8",0
"Ashtray",0,1,93622,Geonosians Omicron,"zzGBA Sun Fac, Geo Soldier, Geo Spy, Poggle",0
"Ashtray",,,72468,Iden Troopers,"Iden Versio 6* G8, Shoretrooper Snowtrooper Magma G9, DT G9",0
"Ashtray",0,1,101906,BH,"Jango zIG-88 Cad Boba Fett, Scion of Jango, Zam",0
"Ashtray",,,80478,Bad Batch,"zHunter Echo 6* G9, Omega G9, zTech G9, zWrecker G9",0
"Loreck Alfonse",,,184204,JMK,"zzzzzzJMK zAhsoka zzzCAT zzzzGAS zGK",1
"Loreck Alfonse",,,143994,Admiral Raddus,"zzAdmiral Raddus, zCassian zzJyn zK-2SO Bistan",1
"Loreck Alfonse",,,149245,SK,"zzEP zzMara Jade, The Emperor's Hand, zzStarkiller zzOld Ben, zVisas",1
"Loreck Alfonse",1,1,104118,NS,"zzMT zzAV zDaka Zombie Spirit",1
"Loreck Alfonse",,,564833,Executor,"Executor 6* HT RC Xanadu Blood, Slave I, IG-2000 Imperial TIE Fighter, Tie Adv",1
"Loreck Alfonse",1,0,143277,CLS,"zzzCLS zHan zzChewbacca zzC-3PO zChewpio",1
"Loreck Alfonse",,,129234,Grievous Omicron,"zzGG zB2 zB1 zMagnaGuard zDroideka",1
"Loreck Alfonse",,,322721,Malevolence,"Malevolence Hyena Bomber, Vulture Droid, Sun Fac SF, Soldier SF, Spy SF",1
"Loreck Alfonse",0,1,108016,Qira,"zQira zL3-37 zVandor Chewbacca, zNest zZaalbar",1
"Loreck Alfonse",0,1,107189,Geonosians Omicron,"zzGBA Sun Fac, Geo Soldier, Geo Spy, Poggle",1
"Loreck Alfonse",,,474419,HansMF,"Home One, Han's MF, Rebel Y-wing, Bistan's U-wing, Phantom Ghost Cassian's U-wing, Wedge X-wing",1
"Loreck Alfonse",1,0,136592,Traya,"zzTraya zzDN zSion Sith Empire Trooper, zzThrawn",1
"Loreck Alfonse",,,111703,Mon Mothma,"zzMon Mothma, Scarif Hoth Rebel Scout, zCara Dune, zPao",1
"Loreck Alfonse",1,1,124325,JTR,"zzzJTR Scav Rey, zzBB-8 zzR2-D2 zFinn",1
"Loreck Alfonse",1,1,149336,Revan Offense,"zzzJKR zzGMY zzHYoda zJolee zJKA",1
"Loreck Alfonse",1,1,91096,Ewoks,"zChirpa Elder zPaploo zWicket zLogray",1
"Loreck Alfonse",1,0,126249,ShaakClones,"zzShaak Ti, zRex zEcho (501st), zzFives zARC Trooper",1
"Loreck Alfonse",0,1,148719,BH,"zzBossk zIG-88 zzJango zBoba zDengar",1
"Loreck Alfonse",1,0,126201,Troopers,"zVeers zStarck Range Trooper, zzPiett zzGideon",1
"Loreck Alfonse",0,1,90848,Phoenix,"zHera zEzra zKanan G8, zZeb G8, Chopper",1
"Loreck Alfonse",0,1,91826,FO,"zzKRU zKylo zPhasma FOO zFOTP",1
"Loreck Alfonse",1,0,98856,Wiggs,"Wedge Biggs zLeia Chirrut Baze",1
"Loreck Alfonse",1,0,130199,zMaul,"zDarth Maul, zBSF zDooku zSidious Sith Marauder",1
"Loreck Alfonse",,,157454,JMLS,"zBS zzzzzzJMLS zWat Tambor, zzJKL zBarriss",0
"Loreck Alfonse",,,506794,Negotiator,"Negotiator BTL-B Y-wing 4*, Anakin's Eta-2, Rex's ARC-170, Umbaran SF, Ahsoka's SF, Plo's SF, Clone Sergeant's ARC-170",0
"WhatAboutBob",0,1,127042,DRMalak,"zzzDR zzHK-47 zBSF zzMalak Sith Empire Trooper",1
"WhatAboutBob",0,1,138450,padme,"zzPadme zGK zJKA zAhsoka zzC-3PO",1
"WhatAboutBob",,,127543,Grievous Omicron,"zzGG zB2 zB1 MagnaGuard zDroideka",1
"WhatAboutBob",,,500263,Negotiator,"Negotiator HT Anakin's Eta-2, Umbaran SF, Ahsoka's SF, Clone Sergeant's ARC-170, Plo's SF, Rex's ARC-170",1
"WhatAboutBob",,,447551,HansMF,"Home One, Han's MF, Biggs X-wing, Bistan's U-wing, Phantom Ghost Cassian's U-wing, Wedge X-wing",1
"WhatAboutBob",1,0,118151,Traya,"zzTraya zzDN zSion zzEP zThrawn",1
"WhatAboutBob",1,1,109816,JTR,"zzzJTR zScav Rey, BB-8 G9, zR2-D2 zFinn",1
"WhatAboutBob",1,1,122649,GAS,"zzzzGAS zRex zEcho (501st), zzFives zARC Trooper",1
"WhatAboutBob",1,1,157341,Revan Offense,"zzzJKR zzGMY zBS zJolee zzHYoda",1
"WhatAboutBob",1,1,111682,Ewoks,"zChirpa Elder zPaploo Scout zWicket",1
"WhatAboutBob",0,1,136926,BH,"zzBossk zJango Cad zBoba zDengar",1
"WhatAboutBob",1,1,120905,Carth,"zCarth Onasi, zMission zZaalbar zJuhani zCanderous",1
"WhatAboutBob",1,0,134075,CLS,"zzzCLS zHan zLeia zFulcrum zzChewbacca",1
"WhatAboutBob",0,1,99870,Phoenix,"zHera zEzra zKanan zZeb zSabine",1
"WhatAboutBob",0,1,100863,FO,"zzKRU zKylo zPhasma FOO zHux",1
"WhatAboutBob",1,1,89543,Rogue1,"zzJyn Chirrut G8, Baze G8, K-2SO zCassian",1
"WhatAboutBob",0,1,99619,Geonosians Omicron,"zzGBA Sun Fac, Geo Soldier, Geo Spy, Poggle",0
"WhatAboutBob",1,1,91496,NS,"zMT zAV zDaka Zombie G9, Spirit G7",0
"WhatAboutBob",,,82287,Mon Mothma,"Mon Mothma 6* G8, Wedge zCara Dune, Bistan Biggs",0
"WhatAboutBob",1,0,73088,Troopers,"Veers zPiett 6* Gideon Dark Trooper 6* G9, Range Trooper 5* G7",0
"WhatAboutBob",1,0,86351,zMaul,"Darth Maul, zSidious zDooku Sith Marauder 6*, Nest 5* G7",0
"WhatAboutBob",,,73314,Iden Troopers,"Iden Versio 6* G8, Stormtrooper G9, Snowtrooper G9, Magma G9, zDT",0
"WhatAboutBob",1,0,78209,Jawas,"Nebit Jawa Engineer, Jawa Scavenger, Jawa 6* Dathcha G9",0
"Ren Gundo",,,124454,Phasma,"zPhasma zFOTP FOSFTP zFOST zKylo",1
"Ren Gundo",1,1,161768,SL Kylo,"zzzzzzSL Kylo, zSith Trooper, zHux zzKRU Thrawn",1
"Ren Gundo",1,1,99485,NS,"zMT zzAV Daka Zombie Spirit",1
"Ren Gundo",,,175221,JMLS,"zzzJKR zzJKL zzzzzzJMLS zzHYoda zzzzGAS",1
"Ren Gundo",1,0,145809,CLS,"zzzCLS zHan zzChewbacca zzC-3PO zChewpio",1
"Ren Gundo",0,1,114977,DRMalak,"zzzDR HK-47 zBSF zzMalak Sith Empire Trooper",1
"Ren Gundo",,,122873,Grievous Omicron,"zzGG zB2 zB1 zMagnaGuard zDroideka",1
"Ren Gundo",0,1,105277,padme,"zzPadme zGK zJKA zAhsoka CW Chewbacca G8",1
"Ren Gundo",,,398847,Negotiator,"Negotiator HT Anakin's Eta-2, Umbaran SF, Ahsoka's SF, BTL-B Y-wing, Clone Sergeant's ARC-170, Plo's SF",1
"Ren Gundo",0,1,92947,Geonosians Omicron,"zzGBA Sun Fac, Geo Soldier, Geo Spy, Poggle",1
"Ren Gundo",,,421535,HansMF,"Home One, Han's MF, Rebel Y-wing, Bistan's U-wing, Phantom Ghost Cassian's U-wing, Biggs X-wing",1
"Ren Gundo",1,1,124375,JTR,"zzzJTR Scav Rey, zBB-8 zzR2-D2 zFinn",1
"Ren Gundo",,,105141,Mon Mothma,"zzMon Mothma, Hoth Rebel Scout, Wedge zCara Dune, Biggs",1
"Ren Gundo",,,426648,Executrix,"Executrix Tie Adv, Emperor's Shuttle, TIE Reaper, Imperial TIE Fighter, Gauntlet Starfighter, FOSF TIE Fighter, FO TIE Fighter",1
"Ren Gundo",1,1,91744,Ewoks,"zChirpa Elder Paploo Wicket zLogray",1
"Ren Gundo",1,0,94064,ShaakClones,"zzShaak Ti, Rex Echo (501st), Fives ARC Trooper",1
"Ren Gundo",0,1,105730,BH,"zBossk Jango zThe Mandalorian, zBoba Dengar",1
"Ren Gundo",1,1,92787,Carth,"Carth Onasi, zMission Zaalbar Juhani zCanderous",1
"Ren Gundo",,,80627,Iden Troopers,"zIden Versio, Shoretrooper Snowtrooper G9, Magma DT",1
"Ren Gundo",0,1,93866,Phoenix,"zHera Ezra zKanan Zeb zSabine",1
"Ren Gundo",1,1,87318,Rogue1,"zJyn Chirrut Baze K-2SO G9, zCassian",1
"Ren Gundo",1,0,106175,EP (Counter, Rebel),"zEP zzWampa Nest Range Trooper, Starck G9",1
"Ren Gundo",1,0,87674,Jawas,"Nebit Jawa Engineer, Jawa Scavenger, Jawa Dathcha",1
"Ren Gundo",1,0,18063,SionSolo (Counter),"Sion",1
"Ren Gundo",,,277185,Malevolence,"Malevolence Hyena Bomber, Vulture Droid 6*, Sun Fac SF, Soldier SF, Spy SF",0
"Ren Gundo",1,0,83105,zMaul,"Darth Maul G8, zDooku DN Sidious Savage",0
"Tupacca",1,0,127276,CLS,"zzCLS zHan zChewbacca zC-3PO zChewpio",1
"Tupacca",0,1,104669,DRMalak,"zzzDR HK-47 zBSF zzMalak 6* Sith Empire Trooper",1
"Tupacca",0,1,108884,padme,"zzPadme zGK JKA zAhsoka CW Chewbacca G8",1
"Tupacca",0,1,90074,Geonosians Omicron,"zGBA Sun Fac, Geo Soldier, Geo Spy, Poggle",1
"Tupacca",1,1,128886,GAS,"zzzzGAS zRex Echo (501st), zzFives ARC Trooper",1
"Tupacca",1,1,110931,Revan Offense,"zzzJKR zGMY zBS zJolee HYoda",1
"Tupacca",1,1,89336,Ewoks,"zChirpa Elder zPaploo Teebo Scout",1
"Tupacca",1,1,84842,Carth,"Carth Onasi G9, Mission Zaalbar Juhani Canderous",1
"Tupacca",0,1,65062,Phoenix,"Hera G9, Ezra G8, Kanan G8, Zeb G8, Chopper G8",1
"Tupacca",,,64886,Phasma,"Phasma G7, FOTP FOO G8, KRU G9, Kylo G9",0
"Tupacca",,,105540,Grievous Omicron,"GG zB2 zB1 MagnaGuard zDroideka",0
"Tupacca",1,1,92417,NS,"zMT zzAV zDaka Zombie Spirit G8",0
"Tupacca",,,313456,HansMF,"Home One, Han's MF, Rebel Y-wing 5*, Bistan's U-wing 6*, Phantom Ghost Cassian's U-wing 6*, Wedge X-wing",0
"Tupacca",1,1,69497,JTR,"JTR G7, Scav Rey G9, BB-8 G8, zR2-D2 Finn G9",0
"Tupacca",,,69119,Mon Mothma,"Mon Mothma 4* G7, Wedge Hoth Rebel Soldier G9, Biggs Lando",0
"Tupacca",1,1,100269,zEP,"zEP zzVader Tarkin TFP zDN",0
"Tupacca",0,1,109602,BH,"Bossk zIG-88 zJango zBoba zGreedo",0
"Tupacca",1,0,49350,zMaul,"Darth Maul G8, Sidious G7, Dooku G6, Sith Marauder 3* G7, Nest 6* G7",0
"Skywolf",,,122879,Phasma,"zPhasma zFOTP FOSFTP zFOST zKylo",1
"Skywolf",1,1,154769,SL Kylo,"zzzzzzSL Kylo, zSith Trooper, zHux zzKRU Thrawn",1
"Skywolf",1,0,145667,CLS,"zzzCLS zHan zzChewbacca zzC-3PO zChewpio",1
"Skywolf",,,164403,JMLS,"zzzzzzJMLS zzJKL zzHYoda zzOld Ben, Ezra",1
"Skywolf",0,1,96534,padme,"zzPadme zGK zJKA Ahsoka CW Chewbacca G8",1
"Skywolf",0,1,91619,Geonosians Omicron,"zzGBA Sun Fac, Geo Soldier, Geo Spy, Poggle",1
"Skywolf",,,438189,HansMF,"Home One, Han's MF, Rebel Y-wing, Ghost Phantom Biggs X-wing, Cassian's U-wing, Wedge X-wing",1
"Skywolf",1,1,125717,JTR,"zJTR zzR2-D2 BB-8 RH Finn, RH Poe",1
"Skywolf",1,0,115368,Traya,"zzTraya zDN zSion BSF zzEP",1
"Skywolf",,,110263,Mon Mothma,"Mon Mothma, Wedge Cara Dune, Biggs Lando",1
"Skywolf",1,1,81480,Ewoks,"zChirpa Elder Paploo Wicket Logray",1
"Skywolf",0,1,139128,BH,"zzBossk zThe Mandalorian, zBoba Dengar zzGreef",1
"Skywolf",0,1,110367,Phoenix,"zHera Kanan zZeb zSabine zCaptain Rex",1
"Skywolf",,,65475,Grievous Omicron,"GG G9, B2 G7, B1 6* G9, MagnaGuard G7, Droideka G8",0
"Skywolf",,,82197,Nute-OR,"Nute G8, Dooku G7, Jango Zaalbar zMission",0
"Skywolf",1,0,60623,ShaakClones,"Shaak Ti 4* G7, Rex G8, Echo (501st) G7, Fives G9, Clone Sergeant G8",0
"Skywolf",1,0,65774,Troopers,"Veers 4* G7, Starck G7, zPiett Gideon Stormtrooper G8",0
"AhsokaStan",,,190527,JMK,"zzzzzzJMK zAhsoka zzzCAT zzzzGAS zGK",1
"AhsokaStan",,,123129,Phasma,"zPhasma zFOTP FOSFTP zFOST zKylo",1
"AhsokaStan",1,1,161869,SL Kylo,"zzzzzzSL Kylo, zSith Trooper, zHux zzKRU zzThrawn",1
"AhsokaStan",1,1,172109,GL Rey,"zzzzzzRey zzzJTR zzR2-D2 zRH Poe, zRH Finn",1
"AhsokaStan",1,0,151729,CLS,"zzzCLS zHan zzChewbacca zzC-3PO zChewpio",1
"AhsokaStan",,,533258,Negotiator,"Negotiator BTL-B Y-wing, Anakin's Eta-2, Rex's ARC-170, Umbaran SF, Ahsoka's SF, Plo's SF, Clone Sergeant's ARC-170",1
"AhsokaStan",0,1,138757,Grievous,"zzGG zB2 zB1 zMagnaGuard zNute",1
"AhsokaStan",1,1,132477,Revan Offense,"zzzJKR G8, zzGMY zzHYoda zJolee G9, zJKA",1
"AhsokaStan",1,0,153196,ShaakClones,"zzShaak Ti, zRex zEcho (501st), zzFives zARC Trooper",1
"AhsokaStan",1,1,99524,Ewoks,"zChirpa Elder zPaploo Teebo zWicket",1
"AhsokaStan",0,1,134999,BH,"zzBossk zzEmbo zJango Boba Zam",1
"AhsokaStan",1,1,122045,zEP,"zzEP zzzVader Tarkin DT zIPD G8",1
"AhsokaStan",,,151398,LV,"zzzzzzLord Vader, zzPiett zzzMaul RG G8, zNinth Sister 6*",0
"AhsokaStan",,,70931,Admiral Raddus,"zzAdmiral Raddus 5*, Cassian G9, Jyn K-2SO G7, Chirrut 6* G8",0
"AhsokaStan",0,1,103229,Geonosians Omicron,"zzGBA Sun Fac, Geo Soldier, Geo Spy, Poggle",0
"AhsokaStan",,,340944,HansMF,"Home One, Han's MF, Rebel Y-wing 5*, Bistan's U-wing 4*, Phantom 6* Biggs X-wing, Cassian's U-wing, Wedge X-wing",0
"AhsokaStan",,,84609,Mon Mothma,"zzMon Mothma G9, Wedge zCara Dune, zPao Biggs",0
"AhsokaStan",1,1,61567,Carth,"Carth Onasi 4* G7, zMission G9, zZaalbar G8, zJuhani 6* G7, Canderous 4* G8",0
"AhsokaStan",1,0,75696,Troopers,"Veers 5* G6, Starck 5* G6, Snowtrooper Magma Scout Trooper",0
"AhsokaStan",0,1,82233,Phoenix,"Hera G7, Ezra G8, Kanan G7, Zeb G8, zzCaptain Rex",0
"AhsokaStan",,,117885,Bad Batch,"zHunter zEcho zzOmega 3* G7, zTech zWrecker",0
"AhsokaStan",1,0,6246,NestSolo (Counter),"Nest 3* G5",0
"jinnergy",,,171759,LV,"zzzzzzLord Vader, zzThrawn zzzVader zRG Tarkin",1
"jinnergy",,,172050,SEE,"zzzzzSEE zBSF zzMalak zzzDR zDooku",1
"jinnergy",1,1,115294,NestSisters,"zzAV zzMT zDaka Zombie zNest",1
"jinnergy",0,1,136578,padme,"zzPadme zGK zJKA zAhsoka zzC-3PO",1
"jinnergy",,,433689,Negotiator,"Negotiator HT Anakin's Eta-2, Umbaran SF, Ahsoka's SF, BTL-B Y-wing, Clone Sergeant's ARC-170, Plo's SF",1
"jinnergy",,,360411,HansMF,"Home One, Han's MF, Biggs X-wing, Bistan's U-wing, Phantom Ghost Cassian's U-wing, Wedge X-wing",1
"jinnergy",1,0,122129,Traya,"zzTraya zDN zSion zzEP Sith Empire Trooper",1
"jinnergy",0,1,105225,Grievous,"zGG zB2 zB1 zDroideka IG-88",1
"jinnergy",1,1,104558,JTR,"zzJTR Scav Rey, zBB-8 zzR2-D2 zFinn",1
"jinnergy",1,1,138141,GAS,"zzzzGAS zRex zEcho (501st), Fives zARC Trooper",1
"jinnergy",1,1,126812,Revan Offense,"zzzJKR zGMY zzHYoda zJolee zEzra",1
"jinnergy",1,1,92561,Ewoks,"zChirpa Elder zPaploo zWicket zLogray",1
"jinnergy",0,1,144804,BH,"zzBossk Cad zBoba zDengar zZam",1
"jinnergy",1,1,84601,Carth,"zCarth Onasi, Mission zZaalbar Juhani G8, Canderous",1
"jinnergy",0,1,122122,BH,"zJango Embo zThe Mandalorian, zzGreef Boba Fett, Scion of Jango",1
"jinnergy",1,0,113527,Troopers,"zVeers zStarck Range Trooper, zzPiett zIden Versio",1
"jinnergy",0,1,74282,Phoenix,"Hera G8, zKanan G8, Zeb G8, zSabine Captain Rex G9",1
"jinnergy",1,1,77490,Rogue1,"Jyn Chirrut Baze G9, K-2SO G9, Cassian G9",1
"jinnergy",,,131705,Bad Batch,"zHunter zEcho zzOmega zTech zWrecker",1
"jinnergy",1,0,76980,Jawas,"Nebit Jawa Engineer, Jawa Scavenger, Jawa Dathcha",1
"jinnergy",,,78752,Phasma,"Phasma G8, FOTP FOE G9, zKRU G9, zKylo",0
"jinnergy",0,1,85954,Geonosians Omicron,"zzGBA Sun Fac G9, Geo Soldier, Geo Spy, Poggle",0
"jinnergy",1,0,115551,CLS,"zzzCLS zHan Wedge G8, Biggs zzChewbacca",0
"Blibo26",1,1,163890,SL Kylo,"zzzzzzSL Kylo, zSith Trooper, zHux zzKRU zThrawn",1
"Blibo26",,,178401,SEE,"zzzzzzSEE zBSF zzMalak zzzDR zzzVader",1
"Blibo26",,,528700,Executor,"Executor 5* HT RC Xanadu Blood, Slave I, IG-2000 Imperial TIE Fighter, Tie Adv",1
"Blibo26",1,0,145989,CLS,"zzzCLS zHan zzChewbacca zzC-3PO zChewpio",1
"Blibo26",,,135183,Grievous Omicron,"zzGG zB2 zB1 zMagnaGuard zDroideka",1
"Blibo26",0,1,88578,Geonosians Omicron,"GBA Sun Fac, Geo Soldier, Geo Spy, Poggle",1
"Blibo26",1,0,142190,Traya,"zzTraya zzDN zSion zDooku zzEP",1
"Blibo26",1,1,137997,GAS,"zzzzGAS zRex Echo (501st), zFives ARC Trooper",1
"Blibo26",1,1,141340,Revan,"zzzJKR zBS zGMY zJolee zGK",1
"Blibo26",1,1,91230,Ewoks,"zChirpa Elder Paploo zWicket zLogray",1
"Blibo26",0,1,132833,BH,"zzBossk IG-88 Jango zBoba zDengar",1
"Blibo26",1,1,92027,Carth,"zCarth Onasi, zMission zZaalbar Juhani G9, zCanderous",1
"Blibo26",0,1,78459,Phoenix,"Hera Ezra Kanan Zeb G8, Chopper",1
"Blibo26",,,122686,Phasma,"Phasma FOTP FOSFTP zFOST zKylo",0
"Blibo26",,,301642,HansMF,"Home One, Han's MF, Rebel Y-wing 4*, Bistan's U-wing 5*, Phantom Ghost Cassian's U-wing, Wedge X-wing",0
"Blibo26",1,1,81448,JTR,"JTR Scav Rey, BB-8 G9, R2-D2 Finn G9",0
"Blibo26",1,0,114853,Troopers,"Veers Starck zzPiett DT Shoretrooper",0
"Blibo26",1,0,106614,QGJ,"QGJ Aayla G2, zJKA zzHYoda zAhsoka",0
"Blibo26",1,0,40359,Jawas,"Nebit 6* G6, Jawa Engineer G6, Jawa Scavenger 5* G6, Jawa G7, Dathcha G7",0
"Shermantime",,,169893,JMK,"zzzzzJMK zJKA zzGMY zzShaak Ti, zGK",1
"Shermantime",,,117135,Phasma,"zPhasma FOTP FOSFTP FOST zKylo",1
"Shermantime",0,1,139999,DRMalak,"zzzDR zzHK-47 zBSF zzMalak Sith Empire Trooper",1
"Shermantime",,,130494,Grievous Omicron,"zzGG zB2 zB1 zMagnaGuard zDroideka",1
"Shermantime",,,556978,Negotiator,"Negotiator HT Anakin's Eta-2, Umbaran SF, Ahsoka's SF, Clone Sergeant's ARC-170, Plo's SF, Rex's ARC-170",1
"Shermantime",1,1,104599,JTR,"zJTR zzR2-D2 BB-8 G9, RH Finn, RH Poe",1
"Shermantime",1,1,154395,GAS,"zzzzGAS zRex zEcho (501st), zzFives zARC Trooper",1
"Shermantime",1,0,123642,CLS,"zzzCLS zHan Chewbacca Thrawn zzC-3PO",1
"Shermantime",1,1,103188,Ewoks,"zChirpa Elder zPaploo zWicket zLogray",1
"Shermantime",1,1,103133,Carth,"zCarth Onasi, zMission Zaalbar zJuhani zCanderous",1
"Shermantime",0,1,133045,BH,"zzBossk zzJango zThe Mandalorian, Cad zBoba",1
"Shermantime",1,1,114219,zEP,"zzEP zzzVader Tarkin TFP G9, Sith Trooper",1
"Shermantime",0,1,74872,Phoenix,"Hera Ezra Kanan G9, Zeb G9, Sabine G8",1
"Shermantime",,,58802,Admiral Raddus,"Admiral Raddus 3* G6, Cassian G9, Jyn G8, K-2SO G8, Chirrut G8",0
"Shermantime",0,1,113981,Geonosians Omicron,"zzGBA Sun Fac, Geo Soldier, Geo Spy, Poggle",0
"Shermantime",,,323591,HansMF,"Home One, Han's MF 6*, Biggs X-wing, Bistan's U-wing 4*, Phantom Ghost Cassian's U-wing, Wedge X-wing",0
"Shermantime",1,1,84316,NS,"MT G8, zzAV Daka Zombie G9, Spirit G9",0
"Shermantime",1,0,70701,Traya,"Traya G9, DN Sion 2* G6, zDooku Sith Assassin G5",0
"Shermantime",,,68298,Mon Mothma,"Mon Mothma 5* G7, Hoth Rebel Scout, Wedge G8, zCara Dune, Biggs G8",0
"Shermantime",,,57043,Iden Troopers,"Iden Versio 4* G7, Stormtrooper G9, Snowtrooper G9, Magma G7, DT",0
"Shermantime",1,0,58849,Troopers,"Veers Starck G7, Dark Trooper 5* G7, Piett 4* G7, Shoretrooper G8",0
"Fordy",,,178996,JMK,"zzzzzzJMK zJKA zzGMY zzShaak Ti, zGK",1
"Fordy",,,124601,Phasma,"zPhasma zFOTP FOSFTP zFOST zKylo",1
"Fordy",,,434939,Profundity,"Profundity 5* Han's MF, Outrider Rebel Y-wing, Cassian's U-wing, Ghost",1
"Fordy",1,1,169735,SL Kylo,"zzzzzzSL Kylo, zSith Trooper, zHux zzKRU zzThrawn",1
"Fordy",,,193780,SEE,"zzzzzzSEE zBSF zzMalak zzzDR zzzVader",1
"Fordy",,,172136,Jabba,"zzzzzzJabba zBoushh (Leia Organa), zSkiff Guard (Lando Calrissian), zKrrsantan zBoba",1
"Fordy",1,1,171131,GL Rey,"zzzzzzRey zzzJTR zzR2-D2 zRH Poe, zRH Finn",1
"Fordy",,,581009,Executor,"Executor HT RC Xanadu Blood, Slave I, IG-2000 Imperial TIE Fighter, Tie Adv",1
"Fordy",,,180841,JMLS,"zzzJKR zzJKL zzzzzzJMLS zWat Tambor, zzzzGAS",1
"Fordy",1,0,160624,CLS,"zzzCLS zHan zzChewbacca zzC-3PO zChewpio",1
"Fordy",1,1,114492,NS_Alt,"zzMT zzAV zzMerrin Zombie zDaka",1
"Fordy",,,493656,Negotiator,"Negotiator BTL-B Y-wing, Anakin's Eta-2, Rex's ARC-170, Umbaran SF, Ahsoka's SF, Plo's SF, Clone Sergeant's ARC-170",1
"Fordy",,,332133,Malevolence,"Malevolence Hyena Bomber, Vulture Droid, Sun Fac SF, Soldier SF, Spy SF",1
"Fordy",0,1,129639,Grievous,"zzGG zB2 zB1 zMagnaGuard zNute",1
"Fordy",1,0,123485,Traya,"zzTraya zzDN Sion zzEP Sith Empire Trooper",1
"Fordy",,,103534,Mon Mothma,"zzMon Mothma, Scarif Hoth Rebel Scout, Wedge Bistan",1
"Fordy",1,1,104206,Ewoks,"zChirpa Elder zPaploo zWicket zLogray",1
"Fordy",1,1,98271,Carth,"zCarth Onasi, zMission zZaalbar Juhani zCanderous",1
"Fordy",0,1,151954,BH,"zzBossk zzJango zDengar zFennec Shand, zzAurra",1
"Fordy",1,0,122645,501st,"zRex zARC Trooper, zEcho (501st), zzFives zAhsoka",1
"Fordy",1,0,124693,Troopers,"zVeers zStarck zDark Trooper, zzPiett zzGideon",1
"Fordy",1,0,129418,zMaul,"zDarth Maul, zSidious zDooku Sith Marauder, Nest",1
"Fordy",0,1,109650,Phoenix,"zHera zKanan zZeb zSabine zzCaptain Rex",1
"Fordy",1,1,113625,Rogue1,"zzJyn Chirrut Baze zK-2SO zCassian",1
"Fordy",1,0,91168,Jawas,"Nebit Jawa Engineer, Jawa Scavenger, Jawa Dathcha",1
"Fordy",0,1,112442,Geonosians Omicron,"zzGBA Sun Fac, Geo Soldier, Geo Spy, Poggle",0
"Fordy",,,81354,Iden Troopers,"zIden Versio, Stormtrooper Snowtrooper G9, Magma G8, zDT",0
"Fordy",,,85185,Bad Batch,"zHunter zEcho Omega G9, zTech zWrecker G8",0
"ThaPhoenix",,,142643,SK,"zzEP zzMara Jade, The Emperor's Hand, zzStarkiller zJuhani zVisas",1
"ThaPhoenix",1,1,133863,NS,"zzMT zzAV zDaka Zombie Spirit",1
"ThaPhoenix",1,0,142065,CLS,"zzzCLS zHan zzChewbacca zzC-3PO zChewpio",1
"ThaPhoenix",,,135186,Grievous Omicron,"zzGG zB2 zB1 zMagnaGuard zDroideka",1
"ThaPhoenix",,,332915,Malevolence,"Malevolence Hyena Bomber, Vulture Droid, Sun Fac SF, Soldier SF, Spy SF",1
"ThaPhoenix",,,485458,Negotiator,"Negotiator HT Anakin's Eta-2, Umbaran SF, Ahsoka's SF, Clone Sergeant's ARC-170, Plo's SF, Rex's ARC-170",1
"ThaPhoenix",,,395209,HansMF,"Home One, Han's MF 5*, Biggs X-wing, Bistan's U-wing, Phantom Ghost Cassian's U-wing, Wedge X-wing",1
"ThaPhoenix",,,127210,Nute-Wat,"zNute zDooku zWat Tambor, zzJango zNest",1
"ThaPhoenix",1,1,153732,GAS,"zzzzGAS zRex zEcho (501st), zzFives zARC Trooper",1
"ThaPhoenix",1,1,85463,Ewoks,"zChirpa Elder Paploo Wicket Logray",1
"ThaPhoenix",0,1,142767,BH,"zzBossk zzThe Mandalorian, zBoba zDengar zzGreef",1
"ThaPhoenix",0,1,103872,Phoenix,"Hera zEzra Kanan Zeb Sabine",1
"ThaPhoenix",,,110573,Phasma,"Phasma FOTP FOSFTP FOST zKylo",0
"ThaPhoenix",0,1,118614,padme,"zzPadme zGK zJKA zAhsoka CW Chewbacca G5",0
"ThaPhoenix",0,1,116018,Geonosians Omicron,"zzGBA Sun Fac, Geo Soldier, Geo Spy, Poggle",0
"ThaPhoenix",1,1,99701,JTR,"JTR G1, zzR2-D2 zzBB-8 RH Finn, RH Poe",0
"ThaPhoenix",0,1,93192,DR,"zzzDR HK-47 zBSF Sith Empire Trooper 6* G7, zThrawn G7",0
"ThaPhoenix",1,0,80797,Troopers,"zVeers Starck G8, zzPiett zIden Versio 5* G9, Stormtrooper G8",0
"ThaPhoenix",1,1,61006,Rogue1,"Jyn G8, Chirrut G8, Baze 6* G8, K-2SO G9, Cassian G8",0
"W1nning 101",,,195562,SEE,"zzzzzzSEE zBSF zzMalak zzzDR zzzVader",1
"W1nning 101",0,1,145988,padme,"zzPadme zGK zJKA zAhsoka zzzCAT",1
"W1nning 101",1,0,146164,CLS,"zzzCLS zHan zzChewbacca zzC-3PO Chewpio",1
"W1nning 101",,,119773,Grievous Omicron,"zzGG zB2 zB1 zMagnaGuard zDroideka",1
"W1nning 101",0,1,110916,Geonosians Omicron,"zzGBA Sun Fac, Geo Soldier, Geo Spy, Poggle",1
"W1nning 101",,,392147,HansMF,"Home One, Han's MF, Rebel Y-wing 6*, Bistan's U-wing, Phantom Ghost Cassian's U-wing, Wedge X-wing",1
"W1nning 101",,,515190,Negotiator,"Negotiator HT Anakin's Eta-2, Umbaran SF, Ahsoka's SF, Clone Sergeant's ARC-170, Plo's SF, Rex's ARC-170",1
"W1nning 101",1,1,116789,JTR,"zzzJTR zScav Rey, BB-8 G9, zzR2-D2 zFinn G8",1
"W1nning 101",,,105112,Mon Mothma,"Mon Mothma, Wedge Cara Dune, Biggs Lando",1
"W1nning 101",1,1,142636,Revan Offense,"zzzJKR zzGMY BS zJolee zzHYoda",1
"W1nning 101",1,1,103084,Ewoks,"zChirpa Elder zPaploo Teebo Scout",1
"W1nning 101",1,1,97988,Carth,"zCarth Onasi, zMission Zaalbar Juhani G8, zCanderous",1
"W1nning 101",0,1,134605,BH,"zzBossk zzThe Mandalorian, zBoba zGreedo zZam",1
"W1nning 101",0,1,85064,Phoenix,"Hera G8, zEzra zKanan zZeb Chopper G9",1
"W1nning 101",0,1,111310,FO,"zzKRU zKylo Phasma FOO FOTP",1
"W1nning 101",1,0,125043,zMaul,"zDarth Maul, zDooku zzDN zSidious Sith Empire Trooper",1
"W1nning 101",1,0,127993,EP (Counter, Rebel),"zzEP Krennic zzWampa Stormtrooper G8, zStarck",1
"W1nning 101",1,0,89150,Jawas,"Nebit Jawa Engineer, Jawa Scavenger, Jawa Dathcha",1
"W1nning 101",1,1,95840,NS,"zzMT zzAV zDaka Zombie G7, Spirit G4",0
"W1nning 101",,,384214,Executrix,"Executrix Tie Adv, Emperor's Shuttle 4*, TIE Reaper 3*, Imperial TIE Fighter, Gauntlet Starfighter, FOSF TIE Fighter, FO TIE Fighter",0
"W1nning 101",1,0,115066,ShaakClones,"zShaak Ti, zRex zEcho (501st), zzFives Clone Sergeant G9",0
"W1nning 101",0,1,94106,BH,"Jango G8, zIG-88 Cad Greef zBoba Fett, Scion of Jango",0
"W1nning 101",1,0,7522,SionSolo (Counter),"Sion 4* G6",0
"Yog Dingham",,,178532,JMK,"zzzzzzJMK zJKA zzGMY zzShaak Ti, zGK",1
"Yog Dingham",,,97232,Phasma,"zPhasma FOE FOSFTP zzKRU Kylo",1
"Yog Dingham",,,165836,SEE,"zzzzzzSEE zBSF zzMalak zzzDR zzzVader",1
"Yog Dingham",1,1,171152,GL Rey,"zzzzzzRey zzzJTR zzR2-D2 zHoldo zRH Finn",1
"Yog Dingham",,,166940,Jabba,"zzzzzzJabba zBoushh (Leia Organa), zSkiff Guard (Lando Calrissian), zKrrsantan zBoba",1
"Yog Dingham",1,1,105731,NS,"zzMT zzAV Daka Zombie Spirit",1
"Yog Dingham",,,578983,Executor,"Executor 6* HT RC Xanadu Blood, Slave I, IG-2000 Imperial TIE Fighter, Tie Adv",1
"Yog Dingham",1,0,157733,CLS,"zzzCLS zHan zzChewbacca zzC-3PO zChewpio",1
"Yog Dingham",,,133685,Grievous Omicron,"zzGG zB2 zB1 zMagnaGuard zDroideka",1
"Yog Dingham",,,478052,Negotiator,"Negotiator BTL-B Y-wing, Anakin's Eta-2, Rex's ARC-170, Umbaran SF, Ahsoka's SF, Plo's SF, Clone Sergeant's ARC-170",1
"Yog Dingham",,,323596,Malevolence,"Malevolence Hyena Bomber, Vulture Droid, Sun Fac SF, Soldier SF, Spy SF",1
"Yog Dingham",0,1,106798,Geonosians Omicron,"zzGBA Sun Fac, Geo Soldier, Geo Spy, Poggle",1
"Yog Dingham",,,139772,JKL,"zzJKL zzzJKR zzHYoda zOld Ben, Aayla",1
"Yog Dingham",,,461304,HansMF,"Home One, Han's MF, Rebel Y-wing, Bistan's U-wing, Phantom Ghost Cassian's U-wing, Wedge X-wing",1
"Yog Dingham",1,0,114575,Traya,"zzTraya zzDN zSion Sith Empire Trooper, zzThrawn",1
"Yog Dingham",,,107771,Mon Mothma,"zzMon Mothma, Wedge zCara Dune, Pao Biggs",1
"Yog Dingham",1,1,116294,GAS,"zzzzGAS zRex zEcho (501st), zzFives zARC Trooper",1
"Yog Dingham",1,1,104954,Ewoks,"zChirpa Elder zPaploo zWicket zLogray",1
"Yog Dingham",1,1,95943,Carth,"zCarth Onasi, Mission zZaalbar zVandor Chewbacca, Canderous",1
"Yog Dingham",0,1,153787,BH,"zzBossk zzJango zDengar zFennec Shand, zzAurra",1
"Yog Dingham",1,0,133962,Troopers,"zVeers zStarck zzPiett zzGideon zScout Trooper",1
"Yog Dingham",1,0,128373,zMaul,"zDarth Maul, zSidious zDooku Sith Marauder, zNest",1
"Yog Dingham",0,1,104052,Phoenix,"zHera Ezra Zeb Sabine zCaptain Rex",1
"Yog Dingham",1,1,89256,Rogue1,"Jyn Chirrut Baze K-2SO Cassian",1
"Yog Dingham",1,0,123746,EP (Counter, Rebel),"zzEP Shoretrooper zKrennic zDT zzWampa",1
"Yog Dingham",1,0,96734,Jawas,"Nebit Jawa Engineer, Jawa Scavenger, Jawa Dathcha",1
